id,gender,masterCategory,subCategory,articleType,baseColour,season,usage,productDisplayName,price_inr
37517,Boys,Accessories,Gloves,Gloves,Yellow,Summer,Casual,Madagascar 3 Infant Boys Yellow Mittens,2236
47096,Boys,Footwear,Sandal,Sandals,Red,Fall,Casual,Marvel Boys Red Sandals,1943
12995,Boys,Footwear,Shoes,Casual Shoes,Brown,Fall,Casual,Timberland Kids Boys Brown Casual Shoes,4047
37538,Boys,Apparel,Socks,Booties,Blue,Summer,Casual,Madagascar 3 Infant Boys Blue Booties,290
35891,Boys,Apparel,Topwear,Tshirts,Yellow,Summer,Casual,Jungle Book Boys Ponya 11 Yellow T-shirt,1496
18531,Boys,Accessories,Watches,Watches,Orange,Winter,Casual,Chhota Bheem Analog Kids-Boys Orange Watch,3458
30717,Boys,Apparel,Apparel Set,Kurta Sets,Green,Summer,Ethnic,Fabindia Boys Green Dhoti Angarakha Sets,3921
39749,Boys,Apparel,Bottomwear,Shorts,Beige,Summer,Casual,Gini Jony Boys Beige Shorts,1271
46881,Boys,Footwear,Flip Flops,Flip Flops,Green,Summer,Casual,Ben 10 Boys Green Flip Flops,5342
37542,Boys,Accessories,Gloves,Gloves,White,Summer,Casual,Madagascar 3 Infant Boys White Mittens,1649
37533,Boys,Apparel,Innerwear,Innerwear Vests,Yellow,Summer,Casual,Madagascar3 Boys Yellow Innerwear Vest,501
47090,Boys,Footwear,Sandal,Sandals,Green,Summer,Casual,Marvel Boys Green Hero Sandals,2181
35383,Boys,Footwear,Shoes,Casual Shoes,Charcoal,Summer,Casual,Enroute Boys Charcoal Shoes,5753
37513,Boys,Apparel,Socks,Booties,White,Summer,Casual,Madagascar 3 Infant Boys White Booties,289
22628,Boys,Apparel,Topwear,Tshirts,Grey,Fall,Sports,Nike Boy Grey T-shirt,1219
18529,Boys,Accessories,Watches,Watches,Red,Winter,Casual,Chhota Bheem kids-Boys Red Digital Pop Watch,4454
36746,Boys,Apparel,Apparel Set,Clothing Set,White,Summer,Casual,Mr.Men Boys Weeee!! White Clothing Set,2200
34060,Boys,Apparel,Bottomwear,Shorts,Grey,Summer,Casual,Gini and Jony Boys Grey Shorts,1940
47087,Boys,Footwear,Flip Flops,Flip Flops,Yellow,Fall,Casual,Marvel Boys Yellow Flip Flops,5800
37540,Boys,Accessories,Gloves,Gloves,Yellow,Summer,Casual,Madagascar 3 Infant Boys Yellow Mittens,2956
37534,Boys,Apparel,Innerwear,Innerwear Vests,Blue,Summer,Casual,Madagascar3 Boys Blue Innerwear Vest,691
47120,Boys,Footwear,Sandal,Sandals,Red,Winter,Casual,Marvel Boys Red and Black Sandals,2391
35384,Boys,Footwear,Shoes,Casual Shoes,Black,Summer,Casual,Enroute Teens Black Shoes,4571
24656,Boys,Accessories,Socks,Socks,White,Fall,Casual,ADIDAS Originals Boys White Pack of 3 Casual Socks,264
36312,Boys,Apparel,Topwear,Tshirts,Navy Blue,Summer,Casual,Mr. Men Boys Mr. Rude Navy Blue T-shirt,1063
18532,Boys,Accessories,Watches,Watches,Blue,Winter,Casual,Chhota Bheem Analog Kids-Boys Torquoise Blue Watch,4240
30718,Boys,Apparel,Apparel Set,Kurta Sets,Red,Summer,Ethnic,Fabindia Boys Red & Beige Angarakha Dhoti Set,2446
38994,Boys,Apparel,Bottomwear,Jeans,Blue,Summer,Casual,Gini and Jony Boys Jeans Blue Jeans,3588
46885,Boys,Footwear,Flip Flops,Flip Flops,Navy Blue,Fall,Casual,Ben 10 Boys Navy Blue Slippers,5803
37519,Boys,Accessories,Gloves,Gloves,White,Summer,Casual,Madagascar 3 Infant Boys White Mittens,2244
37545,Boys,Apparel,Innerwear,Innerwear Vests,Yellow,Summer,Casual,Madagascar3 Boys Yellow Innerwear Vest,605
47118,Boys,Footwear,Sandal,Sandals,Red,Spring,Casual,Marvel Boys Red Spiderman Clogs,1696
14284,Boys,Footwear,Shoes,Casual Shoes,Brown,Fall,Casual,Timberland Kids-Boys Asphlttrl Ek Chk Dk Casual Shoe,5657
37537,Boys,Apparel,Socks,Booties,Yellow,Summer,Casual,Madagascar 3 Infant Boys Yellow Booties,307
25505,Boys,Apparel,Topwear,Tshirts,White,Fall,Casual,Doodle Kids Boys Soccer White T-Shirt,1257
18527,Boys,Accessories,Watches,Watches,Blue,Winter,Casual,Chhota Bheem Analog Kids-Boys Blue Watch,6468
35895,Boys,Apparel,Apparel Set,Clothing Set,Blue,Summer,Casual,Jungle Book Boys Baby Blue Clothing Set,2443
37515,Boys,Apparel,Bottomwear,Leggings,Blue,Summer,Casual,Madagascar3 Infant Boys Blue Leggings,2021
47088,Boys,Footwear,Flip Flops,Flip Flops,Blue,Winter,Casual,Kids Ville Boys Blue Flip Flops,4559
37518,Boys,Accessories,Gloves,Gloves,Blue,Summer,Casual,Madagascar 3 Infant Boys Blue Mittens,2678
36747,Boys,Apparel,Apparel Set,Clothing Set,White,Summer,Casual,Mr.Men Boys I Am Sleeping White Clothing Set,3676
39745,Boys,Apparel,Bottomwear,Shorts,Blue,Summer,Casual,Gini Jony Boys Blue Shorts,1072
47114,Boys,Footwear,Flip Flops,Flip Flops,Navy Blue,Fall,Casual,Marvel Boys Navy Blue Slippers,5324
40126,Boys,Apparel,Bottomwear,Shorts,White,Summer,Casual,Gini and Jony Boys Boxer White Shorts,1292
47113,Boys,Footwear,Flip Flops,Flip Flops,Blue,Fall,Casual,Marvel Boys Blue Slippers,3093
47119,Boys,Footwear,Sandal,Sandals,Navy Blue,Fall,Casual,Marvel Boys Navy Blue Sandals,1722
47124,Boys,Footwear,Shoes,Casual Shoes,Grey,Fall,Casual,Marvel Boys Grey Web Spider Casual Shoes,3144
37512,Boys,Apparel,Socks,Booties,Blue,Summer,Casual,Madagascar 3 Infant Boys Blue Booties,276
41750,Boys,Apparel,Topwear,Tshirts,Green,Summer,Casual,Doodle Boys Printed Green T-shirt,1130
51301,Boys,Accessories,Watches,Watches,Black,Winter,Casual,Hop Scotch Boys Black Watch,6698
30716,Boys,Apparel,Apparel Set,Kurta Sets,Blue,Summer,Ethnic,Fabindia Boys Blue Dhoti Angarakha Set,3714
31111,Boys,Apparel,Bottomwear,Jeans,Black,Summer,Casual,Gini and Jony Boys Solid Black Jeans,3564
47105,Boys,Footwear,Flip Flops,Flip Flops,Green,Fall,Casual,Marvel Boys Green Flip Flops,3067
47112,Boys,Footwear,Sandal,Sandals,Red,Spring,Casual,Marvel Boys Red Spiderman Clogs,1891
47099,Boys,Footwear,Shoes,Casual Shoes,Blue,Summer,Casual,Marvel Boys Red Shoes,3823
37511,Boys,Apparel,Socks,Booties,Yellow,Summer,Casual,Madagascar 3 Infant Boys Yellow Booties,394
39001,Boys,Apparel,Topwear,Tshirts,Red,Summer,Casual,Gini and Jony Boys Core Red T-shirt,1438
18526,Boys,Accessories,Watches,Watches,Green,Winter,Casual,Chhota Bheem Analog Kids-Boys Green Watch,6663
35888,Boys,Apparel,Apparel Set,Clothing Set,Red,Summer,Casual,Jungle Book Boys Baby Red Clothing Set,3631
13306,Boys,Apparel,Bottomwear,Trousers,Black,Fall,Casual,Gini and Jony Kids Solid Black Trousers,3091
46958,Boys,Footwear,Flip Flops,Flip Flops,Green,Fall,Casual,Jungle Book Boys Green Flip Flops,5058
47108,Boys,Footwear,Sandal,Sandals,Black,Fall,Casual,Marvel Boys Black Sandals,1976
10772,Boys,Footwear,Shoes,Casual Shoes,Navy Blue,Winter,Casual,Disney Kids Navy Blue Casual Shoes,4641
18528,Boys,Accessories,Watches,Watches,Green,Winter,Casual,Chhota Bheem Kids-Boys Green Digital Pop Watch,4972
37520,Boys,Apparel,Bottomwear,Shorts,Yellow,Summer,Casual,Madagascar3 Infant Boys Lemon Yellow Shorts,1517
47106,Boys,Footwear,Flip Flops,Flip Flops,Yellow,Winter,Casual,Marvel Boys Yellow Flip Flop,3272
47111,Boys,Footwear,Sandal,Sandals,Blue,Spring,Casual,Marvel Boys Blue Spiderman Clogs,1662
47123,Boys,Footwear,Shoes,Casual Shoes,Blue,Winter,Casual,Marvel Boys Blue Shoes,3510
37596,Boys,Apparel,Topwear,Tshirts,Navy Blue,Summer,Casual,Madagascar3 Boys Navy Blue Printed T-Shirt,1027
47110,Boys,Footwear,Shoes,Casual Shoes,Blue,Spring,Casual,Marvel Boys Blue & Red Spiderman Shoes,4265
3810,Boys,Apparel,Topwear,Tshirts,Blue,Summer,Casual,Disney Kids Boy's Pooh And Tiger Blue Kidswear,1100
34053,Boys,Apparel,Bottomwear,Capris,Yellow,Summer,Casual,Gini and Jony Boys Yellow 3/4 Length Pants,3346
46959,Boys,Footwear,Flip Flops,Flip Flops,Red,Fall,Casual,Jungle Book Boys Red Flip Flops,3282
47117,Boys,Footwear,Sandal,Sandals,Blue,Spring,Casual,Marvel Boys Blue Spiderman Clogs,1872
46883,Boys,Footwear,Shoes,Casual Shoes,Black,Fall,Casual,Ben 10 Boys Black & Silver Shoes,3562
33262,Boys,Apparel,Topwear,Tshirts,White,Summer,Casual,Gini and Jony Boys Printed White T-shirt,1477
40929,Boys,Apparel,Bottomwear,Jeans,Blue,Summer,Casual,Gini and Jony Boys Rodeo Blue Jeans,3131
47091,Boys,Footwear,Flip Flops,Flip Flops,Yellow,Fall,Casual,Marvel Boys Yellow and Orange Slippers,4691
47115,Boys,Footwear,Sandal,Sandals,Blue,Fall,Casual,Marvel Boys Blue Slippers,2455
35382,Boys,Footwear,Shoes,Casual Shoes,Grey,Summer,Casual,Enroute Boys Grey Casual Shoes,4985
37623,Boys,Apparel,Topwear,Tshirts,Blue,Summer,Casual,Madagascar 3 Boys Blue Printed T-shirt,1150
38938,Boys,Apparel,Bottomwear,Shorts,Blue,Summer,Casual,Gini and Jony Boys Blue Shorts,1379
46963,Boys,Footwear,Flip Flops,Flip Flops,Green,Fall,Casual,Jungle Book Boys Green Slippers,5265
47089,Boys,Footwear,Flip Flops,Flip Flops,Red,Winter,Casual,Marvel Boys Red Flip Flop,4078
35386,Boys,Footwear,Shoes,Casual Shoes,Blue,Summer,Casual,Enroute Teens Blue Shoes,5209
3807,Boys,Apparel,Topwear,Tshirts,Red,Summer,Casual,Disney Kids Boy's Red Mickey Ship Kidswear,927
39320,Boys,Apparel,Bottomwear,Shorts,Navy Blue,Summer,Casual,Gini and Jony Boys Navy Blue Shorts,1047
47084,Boys,Footwear,Flip Flops,Flip Flops,Red,Winter,Casual,Marvel Boys Red Incredible Hulk Flip Flops,3772
47125,Boys,Footwear,Shoes,Casual Shoes,Blue,Fall,Casual,Marvel Boys Blue Web Spider Shoes,5085
33138,Boys,Apparel,Topwear,Shirts,White,Summer,Casual,Palm Tree Boys Check White Shirt,2989
31115,Boys,Apparel,Bottomwear,Capris,Blue,Summer,Casual,Gini and Jony Boys Washed Blue 3/4 Length Pants,2051
46962,Boys,Footwear,Flip Flops,Flip Flops,Blue,Fall,Casual,Jungle Book Boys Blue  Slippers,5392
12998,Boys,Footwear,Shoes,Casual Shoes,Black,Fall,Casual,Timberland Kids Boys Casual Black Casual Shoes,4706
34051,Boys,Apparel,Topwear,Shirts,Maroon,Summer,Casual,Palm Tree Boys Maroon Shirt,2244
33264,Boys,Apparel,Bottomwear,Shorts,Beige,Summer,Casual,Gini and Jony Boys Beige Shorts,1916
5372,Boys,Footwear,Shoes,Sports Shoes,Brown,Summer,Sports,Quechua Forclaz 50 Jr 10 Brown,4534
31161,Boys,Apparel,Topwear,Blazers,Navy Blue,Summer,Casual,Gini and Jony Boys Printed Navy Blue Blazer,2273
40160,Boys,Apparel,Bottomwear,Jeans,Navy Blue,Summer,Casual,Gini and Jony Boys Raw Wash Navy Blue Jeans,2310
35381,Boys,Footwear,Shoes,Casual Shoes,Black,Summer,Casual,Enroute Teens Black Shoes,4775
4728,Boys,Apparel,Topwear,Tshirts,Navy Blue,Summer,Casual,Disney Kids Boy's Crew Sea Life Sialing Navy Teen Kidswear,1339
33145,Boys,Apparel,Bottomwear,Shorts,Blue,Summer,Casual,Gini and Jony Boys Blue Shorts,1592
12895,Boys,Footwear,Shoes,Sports Shoes,Black,Fall,Sports,Puma Boys Black Furure Cat Remix Sports Shoes,5370
34028,Boys,Apparel,Topwear,Shirts,Black,Summer,Casual,Gini and Jony Boys Check White & Black Shirt,2410
38937,Boys,Apparel,Bottomwear,Shorts,Blue,Summer,Casual,Gini and Jony Boys Blue Shorts,1707
12994,Boys,Footwear,Shoes,Sports Shoes,Black,Fall,Sports,ADIDAS Kids Boys Duramo Synthetic Black Sports Shoes,3665
4727,Boys,Apparel,Topwear,Tshirts,Blue,Summer,Casual,Disney Kids Boy's Regatta Annual Blue Teen Kidswear,892
46732,Boys,Apparel,Bottomwear,Shorts,Khaki,Summer,Casual,Gini and Jony Boys Khaki Bermuda Shorts,1575
47109,Boys,Footwear,Shoes,Casual Shoes,White,Fall,Casual,Marvel Boys White Shoes,5130
2714,Boys,Apparel,Topwear,Tshirts,Red,Summer,Casual,Disney Kids Boy's Red Goofy Surf Kidswear,1175
37173,Boys,Apparel,Bottomwear,Shorts,Red,Summer,Casual,United Colors of Benetton Boys Knitted shorts,1197
47092,Boys,Footwear,Shoes,Casual Shoes,Blue,Winter,Casual,Marvel Boys Blue Shoes,5371
15046,Boys,Apparel,Topwear,Sweatshirts,Red,Fall,Casual,ADIDAS Kids Boys Solid Red Sweatshirts,1874
31114,Boys,Apparel,Bottomwear,Capris,Blue,Summer,Casual,Gini and Jony Boys Washed Blue 3/4 Length Pants,2434
12996,Boys,Footwear,Shoes,Casual Shoes,Brown,Fall,Casual,Timberland Kids Boys Brown Casual Shoes,5547
10649,Boys,Apparel,Topwear,Shirts,White,Fall,Casual,Doodle Boys Grand Prix White Shirt,1860
41993,Boys,Apparel,Bottomwear,Shorts,Black,Summer,Casual,Gini and Jony Boys Customised Black Shorts,1319
12997,Boys,Footwear,Shoes,Casual Shoes,Brown,Fall,Casual,Timberland Kids Boys Casual Brown Casual Shoes,5856
8348,Boys,Apparel,Topwear,Tshirts,Brown,Fall,Casual,Doodle Boy's Little Monsters Rocking Rust Kidswear,1139
30714,Boys,Apparel,Bottomwear,Churidar,White,Summer,Ethnic,Fabindia Boys White Churidar,2157
46884,Boys,Footwear,Shoes,Casual Shoes,Black,Fall,Casual,Ben 10 Boys Black Casual Shoes,2766
41751,Boys,Apparel,Topwear,Tshirts,Yellow,Summer,Casual,Doodle Boys Printed Yellow T-shirt,1146
41234,Boys,Apparel,Bottomwear,Shorts,Black,Summer,Casual,Gini and Jony Boys Black Shorts,1870
47121,Boys,Footwear,Shoes,Casual Shoes,Navy Blue,Winter,Casual,Marvel Navy Blue Boys Casual Shoes,3579
31103,Boys,Apparel,Topwear,Tshirts,Black,Summer,Casual,Gini and Jony Boys Printed Black T-shirt,1217
38995,Boys,Apparel,Bottomwear,Jeans,Blue,Summer,Casual,Gini and Jony Boys Comics Blue Jeans,2327
47100,Boys,Footwear,Shoes,Casual Shoes,Red,Summer,Casual,Marvel Boys Red Light Spidey Shoes,2759
41754,Boys,Apparel,Topwear,Tshirts,White,Summer,Casual,Doodle Boys Printed White T-shirt,1180
33309,Boys,Apparel,Bottomwear,Jeans,Black,Summer,Casual,Palm Tree Boys Solid Black Jeans,2438
47122,Boys,Footwear,Shoes,Casual Shoes,Red,Winter,Casual,Marvel Boys Black Shoes,5925
34183,Boys,Apparel,Topwear,Tshirts,Green,Summer,Casual,Gini and Jony Boys Green T-shirt,1244
34105,Boys,Apparel,Bottomwear,Shorts,Blue,Summer,Casual,Doodle Boys Check Blue Shorts,1504
38989,Boys,Apparel,Topwear,Tshirts,Yellow,Summer,Casual,Gini and Jony Boys Rodeo Yellow T-shirt,1097
37516,Boys,Apparel,Bottomwear,Leggings,White,Summer,Casual,Madagascar3 Infant Boys White Leggings,1860
35893,Boys,Apparel,Topwear,Tshirts,White,Summer,Casual,Jungle Book Boys Safari White T-shirt,1299
39319,Boys,Apparel,Bottomwear,Shorts,Beige,Summer,Casual,Gini and Jony Boys Beige Shorts,1966
37341,Boys,Apparel,Topwear,Tshirts,Orange,Spring,Casual,U.S. Polo Assn. Kids Boys Orange T-shirt,1182
38939,Boys,Apparel,Bottomwear,Shorts,Blue,Summer,Casual,Gini and Jony Boys Blue Shorts,1576
23131,Boys,Apparel,Topwear,Tshirts,White,Fall,Casual,Chhota Bheem Kids Boys Holi Hai White T-shirt,927
18181,Boys,Apparel,Bottomwear,Jeans,Blue,Fall,Casual,Doodle Boys-Boys Washed Blue Jeans,2597
34168,Boys,Apparel,Topwear,Tshirts,Navy Blue,Summer,Casual,Gini and Jony Boys Printed Navy Blue T-shirt,798
40923,Boys,Apparel,Bottomwear,Jeans,Blue,Summer,Casual,Gini and Jony Boys Jeans Blue Jeans,3487
38884,Boys,Apparel,Topwear,Tshirts,Red,Summer,Casual,Allen Solly Kids Boys Flock Print Red T-shirt,1344
10671,Boys,Apparel,Bottomwear,Shorts,Green,Fall,Casual,Doodle Boy Army  Green Shorts,1614
37525,Boys,Apparel,Topwear,Rompers,White,Summer,Casual,Madagascar3 Infant Boys White Snapsuit Romper,1517
41994,Boys,Apparel,Bottomwear,Shorts,White,Summer,Casual,Gini and Jony Boys Boxer White Shorts,1114
43582,Boys,Apparel,Topwear,Shirts,White,Summer,Casual,Gini and Jony Boys White Check Shirt,2051
38940,Boys,Apparel,Bottomwear,Shorts,Blue,Summer,Casual,Palm Tree Boys Blue Shorts,1679
50718,Boys,Apparel,Topwear,Tshirts,Navy Blue,Summer,Casual,Doodle Boys Navy Blue Printed T-Shirt,1363
37521,Boys,Apparel,Bottomwear,Shorts,Blue,Summer,Casual,Madagascar3 Infant Boys Light Blue Shorts,1655
33304,Boys,Apparel,Topwear,Tshirts,Yellow,Summer,Casual,Gini and Jony Boys Pack of 2 T-shirts,845
54896,Boys,Apparel,Bottomwear,Trousers,Olive,Summer,Casual,Do u speak green Boys Olive Trousers,2549
35896,Boys,Apparel,Topwear,Tshirts,White,Summer,Casual,Superman Boys Crew White T-shirt,864
36203,Boys,Apparel,Bottomwear,Shorts,Beige,Summer,Casual,Gini Jony Boys Beige Shorts,1399
3324,Boys,Apparel,Topwear,Tshirts,Blue,Summer,Sports,KKR Boys Fangear Tee,1426
33259,Boys,Apparel,Bottomwear,Shorts,Blue,Summer,Casual,Gini & Jony Boys Blue Shorts,1831
15045,Boys,Apparel,Topwear,Tshirts,Black,Fall,Sports,ADIDAS Kids Boys Printed Black Tshirts,1235
33308,Boys,Apparel,Bottomwear,Jeans,Black,Summer,Casual,Gini and Jony Boys Solid Black Jeans,2613
40152,Boys,Apparel,Topwear,Tshirts,Red,Summer,Casual,Gini and Jony Boys Surfs Up Red T-shirt,856
30602,Boys,Apparel,Bottomwear,Shorts,Black,Summer,Sports,Nike Boys Basketball Black Shorts,1851
33303,Boys,Apparel,Topwear,Tshirts,Red,Summer,Casual,Gini and Jony Boys Pack of 2 T-shirts,1143
29177,Boys,Apparel,Bottomwear,Shorts,Blue,Summer,Casual,United Colors of Benetton Boys Blue Shorts,1104
5455,Boys,Apparel,Topwear,Tshirts,Green,Summer,Casual,Ant Kids Boy's Musical Buzz Green T-Shirts Kidswear,1411
39752,Boys,Apparel,Bottomwear,Trousers,Khaki,Summer,Casual,Gini Jony Boys Khaki Trousers,2757
38346,Boys,Apparel,Topwear,Tshirts,Blue,Summer,Casual,Superman Boys Blue T-Shirt,1453
31448,Boys,Apparel,Bottomwear,Shorts,Blue,Summer,Sports,Nike Boys Running Blue Shorts,1060
41303,Boys,Apparel,Topwear,Shirts,Navy Blue,Summer,Casual,Gini and Jony Boys Navy Blue Shirt,1903
35435,Boys,Apparel,Bottomwear,Shorts,Blue,Summer,Casual,Doodle Boys Check Blue Shorts,1348
34033,Boys,Apparel,Topwear,Shirts,Green,Summer,Casual,Palm Tree Boys Check Green Shirt,1735
31116,Boys,Apparel,Bottomwear,Shorts,Grey,Summer,Casual,Gini and Jony Boys Grey Shorts,1199
40133,Boys,Apparel,Topwear,Shirts,Blue,Summer,Casual,Gini and Jony Boys Check Blue Shirt,2355
38996,Boys,Apparel,Bottomwear,Jeans,Blue,Summer,Casual,Gini and Jony Boys Rodeo Blue Jeans,2796
36001,Boys,Apparel,Topwear,Tshirts,Orange,Summer,Casual,Ben 10 Boys Crew Orange T-shirt,1117
31110,Boys,Apparel,Bottomwear,Jeans,Grey,Summer,Casual,Gini and Jony Boys Washed Grey Jeans,2452
38942,Boys,Apparel,Topwear,Shirts,White,Summer,Casual,Gini and Jony Boys Check White Shirt,2952
38936,Boys,Apparel,Bottomwear,Shorts,Blue,Summer,Casual,Gini and Jony Boys Blue Shorts,1528
40956,Boys,Apparel,Topwear,Tshirts,Red,Summer,Casual,Gini and Jony Boys Comics Red T-shirt,1019
33283,Boys,Apparel,Bottomwear,Jeans,Black,Summer,Casual,Gini and Jony Boys Black Jeans,3133
37544,Boys,Apparel,Topwear,Tshirts,Blue,Summer,Casual,Madagascar3 Infant Boys Light Blue T-Shirt,1268
2691,Boys,Apparel,Bottomwear,Shorts,Blue,Summer,Casual,Disney Kids Boy's Mickey Blue Denim Kidswear,1452
54907,Boys,Apparel,Topwear,Tshirts,Blue,Summer,Casual,Do u speak green Boys T-shirt,1167
33277,Boys,Apparel,Bottomwear,Jeans,Blue,Summer,Casual,Gini and Jony Boys Washed Blue Jeans,3135
39754,Boys,Apparel,Topwear,Jackets,Red,Summer,Casual,Gini Jony Boys Printed Red Jacket,5007
37522,Boys,Apparel,Bottomwear,Shorts,White,Summer,Casual,Madagascar3 Infant Boys White Shorts,1298
34260,Boys,Apparel,Topwear,Tshirts,Red,Summer,Casual,Gini and Jony Boys Printed Red T-shirt,1332
31112,Boys,Apparel,Bottomwear,Capris,Yellow,Summer,Casual,Gini and Jony Boys Yellow 3/4 Length Pants,2475
35460,Boys,Apparel,Topwear,Tshirts,Green,Summer,Casual,Doodle Boys Printed Green T-shirt,1394
40125,Boys,Apparel,Bottomwear,Shorts,Black,Summer,Casual,Gini and Jony Boys Customised Black Shorts,1375
46833,Boys,Apparel,Topwear,Tshirts,Black,Summer,Casual,Gini and Jony Boys Black T-shirt,926
40925,Boys,Apparel,Bottomwear,Jeans,Blue,Summer,Casual,Gini and Jony Boys Comics Blue Jeans,2724
31104,Boys,Apparel,Topwear,Tshirts,Red,Summer,Casual,Gini and Jony Boys Pack of 2 T-shirts,843
2720,Boys,Apparel,Bottomwear,Trousers,Blue,Summer,Casual,Disney Kids Boy's Mickey Mouse Print Pants,2932
4200,Boys,Apparel,Topwear,Tshirts,Blue,Summer,Casual,Disney Kids Boy's Blue Champs Kidswear,955
33146,Boys,Apparel,Bottomwear,Shorts,Blue,Summer,Casual,Gini and Jony Boys Blue Shorts,1413
31100,Boys,Apparel,Topwear,Shirts,Navy Blue,Summer,Casual,Gini and Jony Boys Check Navy Blue Shirt,1989
39756,Boys,Apparel,Bottomwear,Shorts,White,Summer,Casual,Gini Jony Boys White Shorts,1276
15571,Boys,Apparel,Topwear,Tshirts,Olive,Fall,Casual,Chhota Bheem Kids Boys Spare Me TShirt,1442
41992,Boys,Apparel,Bottomwear,Shorts,Black,Summer,Casual,Gini and Jony Boys Customised Black Shorts,1977
52129,Boys,Apparel,Topwear,Tshirts,White,Summer,Casual,Doodle Boys white Printed T-Shirt,1327
36202,Boys,Apparel,Bottomwear,Shorts,White,Summer,Casual,Gini Jony Boys White Shorts,1918
40141,Boys,Apparel,Topwear,Tshirts,Blue,Summer,Casual,Gini and Jony Boys Core Blue T-shirt,944
39758,Boys,Apparel,Bottomwear,Shorts,Brown,Summer,Casual,Gini Jony Boys Brown Shorts,1032
41991,Boys,Apparel,Topwear,Shirts,Black,Summer,Casual,Gini and Jony Boys Check Black Shirt,2044
34052,Boys,Apparel,Bottomwear,Capris,Yellow,Summer,Casual,Gini and Jony Boys Yellow 3/4 Length Pants,2016
37532,Boys,Apparel,Topwear,Tshirts,Blue,Summer,Casual,Madagascar3 Infant Boys Light Blue T-Shirt,895
34055,Boys,Apparel,Bottomwear,Capris,Blue,Summer,Casual,Palm Tree Boys Washed Blue 3/4 Length Pants,3474
34031,Boys,Apparel,Topwear,Shirts,Blue,Summer,Casual,Gini and Jony Boys Check Blue Shirt,1830
41977,Boys,Apparel,Bottomwear,Shorts,White,Summer,Casual,Gini and Jony Boys Beach White Shorts,1375
24913,Boys,Apparel,Topwear,Tshirts,Red,Summer,Casual,United Colors of Benetton Kids Boys Red Printed T-shirt,808
33278,Boys,Apparel,Bottomwear,Jeans,Blue,Summer,Casual,Gini and Jony Boys Washed Blue Jeans,3472
34039,Boys,Apparel,Topwear,Shirts,Red,Summer,Casual,Palm Tree Boys Check Red Shirt,2266
31113,Boys,Apparel,Bottomwear,Capris,Navy Blue,Summer,Casual,Gini and Jony Boys Washed Navy Blue 3/4 Length Pants,1908
4205,Boys,Apparel,Topwear,Tshirts,Red,Summer,Casual,Disney Kids Boy's Red Mickey Since 1928 Tee Kidswear,976
36211,Boys,Apparel,Bottomwear,Shorts,Blue,Summer,Casual,Gini Jony Boys Blue Shorts,1077
35874,Boys,Apparel,Topwear,Tshirts,Grey,Summer,Casual,Marvel Boys Comics Grey T-shirt,1482
33306,Boys,Apparel,Bottomwear,Jeans,Grey,Summer,Casual,Gini and Jony Boys Washed Grey Jeans,2781
48252,Boys,Apparel,Topwear,Tshirts,Yellow,Summer,Casual,The Amazing Spiderman Boys Yellow T-shirt,828
18180,Boys,Apparel,Bottomwear,Jeans,Blue,Fall,Casual,Doodle Boys-Boys Acid Wash Blue Jeans,3773
5425,Boys,Apparel,Topwear,Shirts,Maroon,Summer,Casual,Ant Kids Boys's Anytime Maroon White Kidswear,2350
29176,Boys,Apparel,Bottomwear,Shorts,Khaki,Summer,Casual,United Colors of Benetton Boys Khaki Shorts,1580
38961,Boys,Apparel,Topwear,Tshirts,Grey,Summer,Casual,Gini and Jony Boys Printed Grey T-shirt,1058
39759,Boys,Apparel,Bottomwear,Shorts,Brown,Summer,Casual,Gini Jony Boys Brown Shorts,1667
37598,Boys,Apparel,Topwear,Tshirts,Blue,Summer,Casual,Madagascar3 Boys Blue Printed T-Shirt,1001
38993,Boys,Apparel,Bottomwear,Jeans,Blue,Summer,Casual,Gini and Jony Boys Rodeo Blue Jeans,3283
35999,Boys,Apparel,Topwear,Tshirts,Red,Summer,Casual,Ben 10 Boys Crew Red T-shirt,961
37514,Boys,Apparel,Bottomwear,Leggings,Yellow,Summer,Casual,Madagascar3 Infant Boys Lemon Yellow Leggings,2452
39002,Boys,Apparel,Topwear,Tshirts,Black,Summer,Casual,Gini and Jony Boys Core Black T-shirt,954
34058,Boys,Apparel,Bottomwear,Capris,Navy Blue,Summer,Casual,Gini and Jony Boys Washed Navy Blue 3/4 Length Pants,3356
10054,Boys,Apparel,Topwear,Tshirts,Blue,Summer,Sports,Reebok Kids Kkr Boy's Premium Blue Jerseys,1132
30603,Boys,Apparel,Bottomwear,Shorts,Maroon,Summer,Sports,Nike Boys Basketball Red Shorts,1607
36722,Boys,Apparel,Topwear,Tshirts,Red,Summer,Casual,Gini and Jony Boys Striped Red T-Shirt,1215
40928,Boys,Apparel,Bottomwear,Jeans,Blue,Summer,Casual,Gini and Jony Boys Rodeo Blue Jeans,3791
31106,Boys,Apparel,Topwear,Tshirts,White,Summer,Casual,Gini and Jony Boys Printed White T-shirt,1142
42594,Boys,Apparel,Bottomwear,Jeans,Blue,Summer,Casual,United Colors of Benetton Boys Blue Slim Fit Jeans,3921
39863,Boys,Apparel,Topwear,Tshirts,Black,Summer,Casual,Gini and Jony Boys Polo Black T-Shirt,1358
39336,Boys,Apparel,Bottomwear,Capris,Blue,Summer,Casual,Gini & Jony Boys Blue Shorts,3297
48243,Boys,Apparel,Topwear,Tshirts,Black,Summer,Casual,Avengers Boys Black Printed T-shirt,1203
31164,Boys,Apparel,Bottomwear,Jeans,Blue,Summer,Casual,Gini and Jony Boys Blue Jeans,2768
39854,Boys,Apparel,Topwear,Tshirts,White,Summer,Casual,Gini and Jony Boys Printed White T-Shirt,906
31166,Boys,Apparel,Bottomwear,Shorts,Blue,Summer,Casual,Gini and Jony Boys Washed Blue Denim Shorts,1683
35459,Boys,Apparel,Topwear,Tshirts,Pink,Summer,Casual,Doodle Boys Printed Pink T-shirt,817
34054,Boys,Apparel,Bottomwear,Capris,Blue,Summer,Casual,Palm Tree Boys Washed Blue 3/4 Length Pants,2737
34035,Boys,Apparel,Topwear,Shirts,Navy Blue,Summer,Casual,Gini and Jony Boys Check Navy Blue Shirt,2184
42595,Boys,Apparel,Bottomwear,Jeans,Grey,Summer,Casual,United Colors of Benetton Boys Grey Slim Fit Jeans,2586
34185,Boys,Apparel,Topwear,Tshirts,Black,Summer,Casual,Gini and Jony Boys Black T-shirt,1409
34056,Boys,Apparel,Bottomwear,Capris,Blue,Summer,Casual,Gini and Jony Boys Washed Blue 3/4 Length Pants,2181
38492,Boys,Apparel,Topwear,Tshirts,Yellow,Summer,Casual,Gini and Jony Boys Core Yellow T-shirt,863
34059,Boys,Apparel,Bottomwear,Shorts,Grey,Summer,Casual,Gini and Jony Boys Grey Shorts,1290
36316,Boys,Apparel,Topwear,Tshirts,White,Summer,Casual,Mr.Men Boys Mr. Messy White T-shirt,1106
34147,Boys,Apparel,Bottomwear,Shorts,Blue,Summer,Casual,Gini and Jony Boys Blue Denim Shorts,1574
40988,Boys,Apparel,Topwear,Tshirts,Blue,Summer,Casual,Gini and Jony Boys Core Blue T-shirt,1463
24995,Boys,Apparel,Bottomwear,Jeans,Blue,Summer,Casual,United Colors of Benetton Boys Boys Blue Washed Jeans,2871
40977,Boys,Apparel,Topwear,Tshirts,Green,Summer,Casual,Gini and Jony Boys Core Green T-shirt,1371
13343,Boys,Apparel,Bottomwear,Shorts,Black,Fall,Casual,Gini and Jony Boys Black Cargo Shorts,1787
38959,Boys,Apparel,Topwear,Tshirts,Navy Blue,Summer,Casual,Gini and Jony Boys Printed Navy Blue T-shirt,1009
41961,Boys,Apparel,Bottomwear,Jeans,Navy Blue,Summer,Casual,Gini and Jony Boys Raw Wash Navy Blue Jeans,3397
37345,Boys,Apparel,Topwear,Tshirts,Blue,Summer,Casual,U.S. Polo Assn Boys Blue T-Shirt,1266
40933,Boys,Apparel,Bottomwear,Jeans,Blue,Summer,Casual,Gini and Jony Boys Rodeo Blue Jeans,2591
8319,Boys,Apparel,Topwear,Tshirts,Red,Fall,Casual,Doodle Boy's Route 66 Biker Red Kidswear,1451
37199,Boys,Apparel,Bottomwear,Shorts,Blue,Summer,Casual,United Colors of Benetton Boys Check Blue Shorts,1086
43696,Boys,Apparel,Topwear,Tshirts,Yellow,Summer,Casual,Doodle Boys Printed Yellow T-shirt,828
40926,Boys,Apparel,Bottomwear,Jeans,Blue,Summer,Casual,Gini and Jony Boys Comics Blue Jeans,3215
35884,Boys,Apparel,Topwear,Tshirts,Blue,Summer,Casual,Jungle Book Boys Little help Blue T-shirt,1007
2722,Boys,Apparel,Bottomwear,Shorts,Blue,Summer,Casual,Disney Kids Boy's Denim Mickey Surf Kidswear,1563
