id,gender,masterCategory,subCategory,articleType,baseColour,season,usage,productDisplayName,price_inr
40999,Girls,Apparel,Bottomwear,Jeans,Black,Summer,Casual,Gini and Jony Girls Woven Black Jeans,3188
40149,Girls,Apparel,Dress,Dresses,Pink,Summer,Casual,Gini and Jony Girls Play Suit Pink Dress,3924
4186,Girls,Apparel,Topwear,Tshirts,Navy Blue,Summer,Casual,Disney Kids Girls Navy Stripes Mickey Kidswear,928
38934,Girls,Apparel,Bottomwear,Leggings,Black,Summer,Casual,Gini and Jony Girls Black Leggings,2404
34167,Girls,Apparel,Dress,Dresses,White,Summer,Casual,Gini and Jony Girls White Dress,3799
17612,Girls,Apparel,Topwear,Tshirts,Grey,Fall,Casual,Doodle Cute Girls  Grey Tshirt,939
38504,Girls,Apparel,Bottomwear,Skirts,Navy Blue,Summer,Casual,Gini and Jony Girls Navy Blue Skirts,2186
42592,Girls,Apparel,Dress,Dresses,Pink,Fall,Casual,United Colors of Benetton Kids Girls Pink Printed Dress,3692
43576,Girls,Apparel,Topwear,Tops,White,Summer,Casual,Gini and Jony Girls Knits White Top,1520
38505,Girls,Apparel,Bottomwear,Skirts,Blue,Summer,Casual,Gini and Jony Girls Woven Blue Skirt,1701
34095,Girls,Apparel,Dress,Dresses,Off White,Summer,Casual,Doodle Girls Printed Multi Coloured Dress,3551
33152,Girls,Apparel,Topwear,Tops,Green,Summer,Casual,Gini and Jony Girls Printed Green Top,1900
37559,Girls,Apparel,Bottomwear,Shorts,Green,Summer,Casual,Madagascar3 Girls Green Shorts,1046
35433,Girls,Apparel,Dress,Dresses,Blue,Summer,Casual,Doodle Girls Printed Blue Dress,3416
34008,Girls,Apparel,Topwear,Tops,Pink,Summer,Casual,Gini and Jony Girls Pink Top,1495
30730,Girls,Apparel,Bottomwear,Salwar,Purple,Summer,Ethnic,Fabindia Girls Printed Purple Salwar,2731
52128,Girls,Apparel,Dress,Dresses,Blue,Summer,Casual,Doodle Girls Blue Washed Dress,3722
38340,Girls,Apparel,Topwear,Tops,Off White,Summer,Casual,Mr. Men Little Miss Girls Off White Top,1085
54923,Girls,Apparel,Bottomwear,Capris,Olive,Summer,Casual,Do u speak Green Girls Olive 3/4 Pant,1926
52131,Girls,Apparel,Dress,Dresses,Blue,Summer,Casual,Doodle Girls Blue Printed Dress,3070
36728,Girls,Apparel,Topwear,Tops,Peach,Summer,Casual,Gini and Jony Girls Printed Peach Top,1485
40930,Girls,Apparel,Bottomwear,Leggings,Blue,Summer,Casual,Gini and Jony Girls Happy Style Blue Leggings,2245
29167,Girls,Apparel,Dress,Dresses,Red,Summer,Casual,United Colors of Benetton Girls Red Polka Dot Dress,2712
3851,Girls,Apparel,Topwear,Tshirts,Pink,Summer,Casual,Disney Kids Girl's Minnie Heart Pink Kidswear,1058
39326,Girls,Apparel,Bottomwear,Leggings,Black,Summer,Casual,Gini and Jony Girls Black Leggings,2202
46813,Girls,Apparel,Bottomwear,Skirts,Pink,Summer,Casual,Gini and Jony Girls Pink Skirt,1674
37634,Girls,Apparel,Topwear,Tshirts,Pink,Summer,Casual,Madagascar3 Girls Pink Printed T-Shirt,1200
35436,Girls,Apparel,Bottomwear,Shorts,Blue,Summer,Casual,Doodle Girls Washed Blue Shorts,1541
2744,Girls,Apparel,Topwear,Tops,Orange,Summer,Casual,Disney Kids Girl's Orange Stripe Kidswear,1936
41236,Girls,Apparel,Bottomwear,Capris,Black,Summer,Casual,Gini and Jony Kids Girls Black Capris,1684
36727,Girls,Apparel,Topwear,Tops,Blue,Summer,Casual,Gini and Jony Girls Printed Blue Top,1304
37558,Girls,Apparel,Bottomwear,Shorts,Pink,Summer,Casual,Madagascar3 Girls Pink Shorts,1301
38949,Girls,Apparel,Topwear,Tops,Pink,Summer,Casual,Gini and Jony Girls Printed Pink Top,1676
41976,Girls,Apparel,Bottomwear,Capris,White,Summer,Casual,Gini and Jony Girls White Pedal Pusher,2621
31120,Girls,Apparel,Topwear,Tops,Pink,Summer,Casual,Palm Tree Girls Pink Top,1833
34148,Girls,Apparel,Bottomwear,Skirts,Blue,Summer,Casual,Gini and Jony Girls Washed Blue Skirt,1844
4213,Girls,Apparel,Topwear,Tshirts,Pink,Summer,Casual,Disney Kids Girl's Pink Summer Fun Fair Kidswear,1263
40145,Girls,Apparel,Bottomwear,Capris,Pink,Summer,Casual,Gini and Jony Girls Kinky Pink Capris,2970
43577,Girls,Apparel,Topwear,Tops,Peach,Summer,Casual,Gini and Jony Girls Woven Peach Top,1976
41008,Girls,Apparel,Bottomwear,Jeans,Navy Blue,Summer,Casual,Gini and Jony Girls Woven Navy Blue Jeans,2473
31174,Girls,Apparel,Topwear,Tops,Red,Summer,Casual,Gini and Jony Girls Red Top,1751
33273,Girls,Apparel,Bottomwear,Leggings,Green,Summer,Casual,Gini and Jony Girls Green Leggings,1796
23625,Girls,Apparel,Topwear,Tops,Pink,Fall,Casual,Doodle Kids Girls Pink Retro Top,1627
41006,Girls,Apparel,Bottomwear,Shorts,Navy Blue,Summer,Casual,Gini and Jony Girls Woven Navy Blue Shorts,1128
43687,Girls,Apparel,Topwear,Tops,Pink,Summer,Casual,Doodle Girls Pink Top,1084
29171,Girls,Apparel,Bottomwear,Skirts,Blue,Summer,Casual,United Colors of Benetton Kids Girls Washed Blue Skirt,2073
2715,Girls,Apparel,Topwear,Tops,Orange,Summer,Casual,Disney Kids Girl's Minnie Orange Stripped Kidswear,1847
40931,Girls,Apparel,Bottomwear,Leggings,Blue,Summer,Casual,Gini and Jony Girls Happy Style Blue Leggings,1929
41971,Girls,Apparel,Topwear,Tops,Blue,Summer,Casual,Gini and Jony Girls Summer Up Blue Top,1754
24993,Girls,Apparel,Bottomwear,Shorts,Navy Blue,Summer,Casual,United Colors of Benetton Kids Girls Navy Blue Shorts,1326
4216,Girls,Apparel,Topwear,Tshirts,Yellow,Summer,Casual,Disney Kids Girl's Yellow Fun In The Fair Kidswear,896
39323,Girls,Apparel,Bottomwear,Shorts,Blue,Summer,Casual,Gini and Jony Girls Blue Shorts,1915
33266,Girls,Apparel,Topwear,Tops,Teal,Summer,Casual,Gini and Jony Girls Teal Top,1472
40996,Girls,Apparel,Bottomwear,Capris,Pink,Summer,Casual,Gini and Jony Girls Woven Pink Pedal Pusher,2929
42419,Girls,Apparel,Topwear,Tops,White,Summer,Casual,Gini and Jony Girls Knit White Top,1621
41004,Girls,Apparel,Bottomwear,Skirts,Navy Blue,Summer,Casual,Gini and Jony Girls Woven Navy Blue Skirts,2026
36212,Girls,Apparel,Topwear,Tops,Black,Summer,Casual,Gini Jony Girls Black Top,1203
34693,Girls,Apparel,Bottomwear,Shorts,Pink,Summer,Casual,Allen Solly Kids Girls Poplin Pink Shorts,1433
34111,Girls,Apparel,Topwear,Tops,Navy Blue,Summer,Casual,Doodle Girls Striped Navy Blue Top,1805
37582,Girls,Apparel,Bottomwear,Shorts,White,Summer,Casual,Madagascar3 Girls White Shorts,1277
31117,Girls,Apparel,Topwear,Tops,White,Summer,Casual,Gini and Jony Girls White Top,1104
39324,Girls,Apparel,Bottomwear,Shorts,Blue,Summer,Casual,Gini and Jony Girls Blue Shorts,1691
41757,Girls,Apparel,Topwear,Tops,Yellow,Summer,Casual,Doodle Girls Printed Yellow Top,1757
38935,Girls,Apparel,Bottomwear,Leggings,Black,Summer,Casual,Gini and Jony Girls Black Leggings,3187
34004,Girls,Apparel,Topwear,Tops,White,Summer,Casual,Gini and Jony Girls White Top,1626
41312,Girls,Apparel,Bottomwear,Capris,Pink,Summer,Casual,Gini and Jony Girls Fixed Weast Pink Capris,2220
24946,Girls,Apparel,Topwear,Tops,White,Summer,Casual,United Colors of Benetton Kids Girls White Printed Top,1193
40146,Girls,Apparel,Bottomwear,Capris,Black,Summer,Casual,Gini and Jony Girls Elasticated Black Capris,2235
36754,Girls,Apparel,Topwear,Tops,White,Summer,Casual,Little Miss Girls Blazing White Top,1025
42003,Girls,Apparel,Bottomwear,Capris,Black,Summer,Casual,Gini and Jony Girls Elasticated Black Capris,2142
31172,Girls,Apparel,Topwear,Tops,Peach,Summer,Casual,Gini and Jony Girls Peach Top,1493
34721,Girls,Apparel,Bottomwear,Trousers,Black,Summer,Casual,Allen Solly Kids Girls Twill Black Trousers,3230
2718,Girls,Apparel,Topwear,Tops,Red,Summer,Casual,Disney Kids Girl's Red Pooh Kidswear,1276
41000,Girls,Apparel,Bottomwear,Shorts,Blue,Summer,Casual,Gini and Jony Girls Woven Blue Shorts,1133
31175,Girls,Apparel,Topwear,Tops,Magenta,Summer,Casual,Gini and Jony Girls Purple Top,1326
16806,Girls,Apparel,Bottomwear,Shorts,White,Fall,Casual,ANT Kids Girls Solid White Short,1812
34163,Girls,Apparel,Topwear,Tops,White,Summer,Casual,Gini and Jony Girls White Top,1951
40998,Girls,Apparel,Bottomwear,Jeans,Black,Summer,Casual,Palm Tree Girls Woven Black Jeans,2376
3819,Girls,Apparel,Topwear,Tshirts,Pink,Summer,Casual,Disney Kids Girl's Minnie Summer Time Pink Top,1344
39330,Girls,Apparel,Bottomwear,Skirts,White,Summer,Casual,Gini & Jony Girls White Skirt,1902
8359,Girls,Apparel,Topwear,Tshirts,Pink,Fall,Casual,Doodle Girl's Princess Cute Little Pink Kidswear,1111
13341,Girls,Apparel,Bottomwear,Capris,Purple,Fall,Casual,Gini and Jony Girls Purple Capris,2607
8419,Girls,Apparel,Topwear,Tshirts,Blue,Fall,Casual,Doodle Girl's Crazy Funny Blue Teen Kidswear,1326
42001,Girls,Apparel,Bottomwear,Capris,Pink,Summer,Casual,Gini and Jony Girls Kinky Pink Capris,3346
8358,Girls,Apparel,Topwear,Tshirts,Blue,Fall,Casual,Doodle Girl's Princess Cute Little Light Blue Kidswear,875
33147,Girls,Apparel,Bottomwear,Jeans,Blue,Summer,Casual,Gini and Jony Girls Blue Jeans,2697
34017,Girls,Apparel,Topwear,Tops,Red,Summer,Casual,Gini and Jony Girls Red Top,1703
47151,Girls,Apparel,Bottomwear,Capris,Black,Summer,Casual,Gini and Jony Kids Girls Black Capris,1689
8382,Girls,Apparel,Topwear,Tshirts,Blue,Fall,Casual,Doodle Girl's Raw Edges Light Blue Kidswear,1278
47153,Girls,Apparel,Bottomwear,Capris,Pink,Summer,Casual,Gini and Jony Girls Pink Capris,2515
25520,Girls,Apparel,Topwear,Tops,White,Fall,Casual,Doodle Kids Girls City Chic White Top,1463
29172,Girls,Apparel,Bottomwear,Skirts,Pink,Summer,Casual,United Colors of Benetton Kids Girls Printed Pink Skirt,2211
41300,Girls,Apparel,Topwear,Tshirts,Green,Summer,Casual,Gini and Jony Girls Polo Striped Blue T-shirt,1042
40997,Girls,Apparel,Bottomwear,Jeans,Black,Summer,Casual,Gini and Jony  Girls Woven Black Jeans,2484
38950,Girls,Apparel,Topwear,Tops,White,Summer,Casual,Palm Tree Girls White Top,1659
39011,Girls,Apparel,Bottomwear,Leggings,Blue,Summer,Casual,Gini and Jony Girls Happy Style Blue Leggings,3103
37567,Girls,Apparel,Topwear,Tshirts,Green,Summer,Casual,Madagascar3 Infant Girls Light Green  T-Shirt,1464
33272,Girls,Apparel,Bottomwear,Capris,Pink,Summer,Casual,Gini & Jony Girls Pink Pedal Pusher,2206
3852,Girls,Apparel,Topwear,Tshirts,Pink,Summer,Casual,Disney Kids Girl's Pink Daisy Kidswear,1276
33274,Girls,Apparel,Bottomwear,Leggings,Black,Summer,Casual,Gini and Jony Girls Black Leggings,3080
8418,Girls,Apparel,Topwear,Tshirts,Blue,Fall,Casual,Doodle Girl's Crazy Funny Blue Kidswear,1111
16805,Girls,Apparel,Bottomwear,Skirts,Black,Fall,Casual,ANT Kids Girls Printed Black Skirt,2431
34091,Girls,Apparel,Topwear,Tops,Grey,Summer,Casual,Doodle Girls Printed Grey Top,1768
33149,Girls,Apparel,Bottomwear,Leggings,Pink,Summer,Casual,Gini and Jony Girls Pink Leggings,1928
38290,Girls,Apparel,Topwear,Tops,Turquoise Blue,Summer,Casual,Kids Ville Girls Turquoise Blue Top,1566
41005,Girls,Apparel,Bottomwear,Skirts,Navy Blue,Summer,Casual,Gini and Jony Girls Woven Navy Blue Skirts,1907
40991,Girls,Apparel,Topwear,Tops,Yellow,Summer,Casual,Gini and Jony Girls Milan Yellow Top,1261
41010,Girls,Apparel,Bottomwear,Jeans,Navy Blue,Summer,Casual,Gini and Jony Girls Woven Navy Blue Jeans,2480
2703,Girls,Apparel,Topwear,Tops,Pink,Summer,Casual,Disney Kids Girl's Check Pink Kidswear,1551
39830,Girls,Apparel,Bottomwear,Shorts,Purple,Summer,Casual,Gini and Jony Girls Core Purple Shorts,1917
39836,Girls,Apparel,Topwear,Tops,Peach,Summer,Casual,Gini and Jony Girls Printed Peach Top,1768
38931,Girls,Apparel,Bottomwear,Jeans,Blue,Summer,Casual,Gini and Jony Girls Blue Jeans,2510
43041,Girls,Apparel,Topwear,Tops,Pink,Summer,Casual,Gini and Jony Girls Pink Top,1849
40995,Girls,Apparel,Bottomwear,Capris,Pink,Summer,Casual,Gini and Jony Girls Woven Pink Pedal Pusher,2082
37629,Girls,Apparel,Topwear,Tshirts,Blue,Summer,Casual,Madagascar3 Girls Blue Printed T-Shirt,1368
38766,Girls,Apparel,Bottomwear,Shorts,Pink,Summer,Casual,Gini and Jony Girls Pink Shorts,1925
34012,Girls,Apparel,Topwear,Tops,White,Summer,Casual,Palm Tree Girls Printed White Top,1468
35437,Girls,Apparel,Bottomwear,Shorts,Black,Summer,Casual,Doodle Girls Washed Black Shorts,1710
18179,Girls,Apparel,Topwear,Tops,Black,Fall,Casual,Doodle Kids Girls Black Layer Top,1490
17620,Girls,Apparel,Bottomwear,Leggings,Red,Fall,Casual,Doodle Girls Red Leggings,2453
39845,Girls,Apparel,Topwear,Tops,Green,Summer,Casual,Gini And Jony Girls Striped Green Top,1487
38933,Girls,Apparel,Bottomwear,Leggings,Pink,Summer,Casual,Gini and Jony Girls Pink Leggings,2291
43592,Girls,Apparel,Topwear,Tshirts,Pink,Summer,Casual,Gini and Jony Girls Polo Striped Pink T-shirt,1046
37580,Girls,Apparel,Bottomwear,Shorts,Pink,Winter,Casual,Madagascar 3 Girls Pink Shorts,1207
43575,Girls,Apparel,Topwear,Tops,White,Summer,Casual,Gini and Jony Girls Knits White Top,1654
36217,Girls,Apparel,Bottomwear,Shorts,Pink,Summer,Casual,Gini Jony Girls Pink Shorts,1975
2740,Girls,Apparel,Topwear,Tops,Blue,Summer,Casual,Disney Kids Girl's Blue Kidswear,1183
34149,Girls,Apparel,Bottomwear,Skirts,Blue,Summer,Casual,Gini and Jony Girls Washed Blue Skirt,1825
3892,Girls,Apparel,Topwear,Tshirts,Pink,Summer,Casual,Disney Kids Girl's Pink Minnie Top With Green Bow Kidswear,986
5575,Girls,Apparel,Bottomwear,Skirts,Green,Summer,Casual,Ant Kids Girl's Green Kidswear,2248
18178,Girls,Apparel,Topwear,Tops,Black,Fall,Casual,Doodle Kids Girls Black Layer Top,1375
37209,Girls,Apparel,Bottomwear,Jeans,Blue,Summer,Casual,United Colors of Benetton Girls Blue Jeans,2251
38336,Girls,Apparel,Topwear,Tops,Pink,Summer,Casual,Mr. Men Little Miss Girls Pink Top,1329
33267,Girls,Apparel,Bottomwear,Shorts,Blue,Summer,Casual,Gini and Jony Girls Blue Shorts,1488
34165,Girls,Apparel,Topwear,Tops,White,Summer,Casual,Gini and Jony Girls Printed White Top,1178
41995,Girls,Apparel,Bottomwear,Capris,Blue,Summer,Casual,Gini and Jony Girls Blue Pedal Pusher,1995
33153,Girls,Apparel,Topwear,Tops,White,Summer,Casual,Gini and Jony Girls Printed White Top,1165
17621,Girls,Apparel,Bottomwear,Leggings,Pink,Fall,Casual,Doodle Girls Lace Bow LT.Pink Leggings,3236
8366,Girls,Apparel,Topwear,Tshirts,Green,Fall,Casual,Doodle Girl's I Love My Bicycle Green Kidswear,916
3901,Girls,Apparel,Bottomwear,Skirts,Blue,Summer,Casual,Disney Kids Girl's Pooh Denim Blue Skirt,1955
8381,Girls,Apparel,Topwear,Tshirts,Purple,Fall,Casual,Doodle Girl's Raw Edges Purple Teen Kidswear,1037
30728,Girls,Apparel,Bottomwear,Salwar,Orange,Summer,Ethnic,Fabindia Girls Orange Mangalgiri Salwar,3473
38946,Girls,Apparel,Topwear,Tops,Green,Summer,Casual,Gini and Jony Girls Printed Green Top,1721
39314,Girls,Apparel,Bottomwear,Skirts,Red,Summer,Casual,Gini and Jony Girls Red Skirt,1925
34003,Girls,Apparel,Topwear,Tops,White,Summer,Casual,Gini and Jony Girls White Top,1909
37202,Girls,Apparel,Bottomwear,Jeans,Grey,Summer,Casual,United Colors of Benetton Girls Washed Grey Jeans,2674
34161,Girls,Apparel,Topwear,Tops,Black,Summer,Casual,Gini and Jony Girls Black Top,1062
38502,Girls,Apparel,Bottomwear,Shorts,Navy Blue,Summer,Casual,Gini and Jony Girls Woven Navy Blue Shorts,1289
24943,Girls,Apparel,Topwear,Tshirts,White,Summer,Casual,United Colors of Benetton Kids Girls White T-shirt,1174
21863,Girls,Apparel,Topwear,Tops,Yellow,Fall,Casual,Chhota Bheem Kids Girls Lets Catch Them Yellow Top,1966
21853,Girls,Apparel,Topwear,Tshirts,Orange,Fall,Casual,Chhota Bheem Kids Girls Sea Princess Light Orange T-shirt,1058
40144,Girls,Apparel,Topwear,Tops,Pink,Summer,Casual,Gini and Jony Girls Pretty Blossom Pink Top,1631
40989,Girls,Apparel,Topwear,Tops,White,Summer,Casual,Gini and Jony Girls Milan White Top,1552
38768,Girls,Apparel,Topwear,Tshirts,Blue,Summer,Casual,Gini and Jony Girls Printed Blue T-shirt,1277
41310,Girls,Apparel,Topwear,Tops,White,Summer,Casual,Gini and Jony Girls Knits White Top,1465
38285,Girls,Apparel,Topwear,Tops,Pink,Summer,Casual,Kids Ville Girls Pink Printed Top,1292
34014,Girls,Apparel,Topwear,Tops,White,Summer,Casual,Gini and Jony Girls Printed White Top,1542
35447,Girls,Apparel,Topwear,Tops,Red,Summer,Casual,Doodle Girls Printed Red Top,1420
17609,Girls,Apparel,Topwear,Tshirts,White,Fall,Casual,Doodle Girls Raindrops White Tshirts,812
37626,Girls,Apparel,Topwear,Tshirts,Pink,Summer,Casual,Madagascar3 Girls Pink Printed T-Shirt,1464
37637,Girls,Apparel,Topwear,Tshirts,Teal,Summer,Casual,Madagascar3 Girls Teal Printed T-Shirt,1485
36744,Girls,Apparel,Topwear,Tops,Pink,Summer,Casual,Little Miss Girls Naughty Pink Top,1181
34710,Girls,Apparel,Topwear,Tshirts,Green,Summer,Casual,Allen Solly Kids Girls Polka Green T-shirt,1439
24941,Girls,Apparel,Topwear,Tops,Pink,Summer,Casual,United Colors of Benetton Kids Girls Pink Top,1816
8383,Girls,Apparel,Topwear,Tshirts,Blue,Fall,Casual,Doodle Girl's Raw Edges Light Blue Teen Kidswear,1343
4717,Girls,Apparel,Topwear,Tshirts,Pink,Summer,Casual,Disney Kids Girl's Summer Fun Fair Pink Teen Kidswear,1278
4719,Girls,Apparel,Topwear,Tshirts,White,Summer,Casual,Disney Kids Girl's Fun In The Fair White Teen Kidswear,1247
35444,Girls,Apparel,Topwear,Tops,Pink,Summer,Casual,Doodle Girls Pink Top,1598
40945,Girls,Apparel,Topwear,Tops,Navy Blue,Summer,Casual,Gini and Jony Girls Nautical Blues Navy Blue Top,1228
34007,Girls,Apparel,Topwear,Tops,Pink,Summer,Casual,Gini and Jony Girls Pink Top,1986
43042,Girls,Apparel,Topwear,Tops,Pink,Summer,Casual,Gini and Jony Girls Pink Top,1882
31119,Girls,Apparel,Topwear,Tops,Purple,Summer,Casual,Gini and Jony Girls Purple Top,1047
37636,Girls,Apparel,Topwear,Tshirts,Red,Summer,Casual,Madagascar3 Girls Soft Red Printed T-Shirt,1484
37570,Girls,Apparel,Topwear,Tops,Pink,Summer,Casual,Madagascar3 Infant Girls Pink Spaghetti Top,1568
40938,Girls,Apparel,Topwear,Tops,Magenta,Summer,Casual,Gini and Jony Girls Nautical Blues Magenta Top,1771
3893,Girls,Apparel,Topwear,Tshirts,Green,Summer,Casual,Disney Kids Girl's Green Minnie Top With Pink Bow Kidswear,1384
30726,Girls,Apparel,Topwear,Lehenga Choli,Blue,Summer,Ethnic,Fabindia Girls Printed Blue Lehenga Choli,1823
38947,Girls,Apparel,Topwear,Tops,Green,Summer,Casual,Gini and Jony Girls Printed Green Top,1133
37585,Girls,Apparel,Topwear,Rompers,White,Summer,Casual,Madagascar3 Infant Girls White Snapsuit Romper,2218
2706,Girls,Apparel,Topwear,Tops,Pink,Summer,Casual,Disney Kids Girl's Pink Pooh Kidswear,1560
36207,Girls,Apparel,Topwear,Tops,White,Summer,Casual,Gini Jony Girls Printed White Top,1286
4214,Girls,Apparel,Topwear,Tshirts,Yellow,Summer,Casual,Disney Kids Girl's Yellow Summer Fun Fair Kidswear,1109
3898,Girls,Apparel,Topwear,Tshirts,Pink,Summer,Casual,Disney Kids Girl's Pink Pooh And Tree Kidswear,865
4217,Girls,Apparel,Topwear,Tshirts,Blue,Summer,Casual,Disney Kids Girl's Blue Disney Jeans Kidswear,1354
39010,Girls,Apparel,Topwear,Tops,Pink,Summer,Casual,Gini and Jony Girls Kitch Peachy Pink Top,1947
37561,Girls,Apparel,Topwear,Rompers,Pink,Summer,Casual,Madagascar3 Infant Girls Pink Snapsuit Romper,1377
4724,Girls,Apparel,Topwear,Tshirts,Yellow,Summer,Casual,Disney Kids Girl's Yellow Teen Kidswear,1016
35448,Girls,Apparel,Topwear,Tops,Red,Summer,Casual,Doodle Girls Printed Red Top,1408
3897,Girls,Apparel,Topwear,Tshirts,White,Summer,Casual,Disney Kids Girl's Pooh And Hearts White Kidswear,906
3899,Girls,Apparel,Topwear,Tshirts,White,Summer,Casual,Disney Kids Girl's Pooh And Tree White Kidswear,1483
37630,Girls,Apparel,Topwear,Tshirts,Red,Summer,Casual,Madagascar3 Girls Soft Red Printed T-Shirt,947
41301,Girls,Apparel,Topwear,Tshirts,Pink,Summer,Casual,Gini and Jony Grils Polo Striped Pink T-shirt,1324
41744,Girls,Apparel,Topwear,Tops,White,Summer,Casual,Doodle Girls Printed White Top,1382
39841,Girls,Apparel,Topwear,Tops,Pink,Summer,Casual,Gini and Jony Girls Striped Pink Top,1699
5215,Girls,Apparel,Topwear,Tshirts,White,Summer,Casual,Disney Kids Girl's Pink White Sweet Hunny Pack of 2 Kidswear,846
8415,Girls,Apparel,Topwear,Tshirts,White,Fall,Casual,Doodle Girl's Hippie Chic White Teen Kidswear,993
38337,Girls,Apparel,Topwear,Tops,Yellow,Summer,Casual,Mr. Men Little Miss Girls Yellow Top,1672
34164,Girls,Apparel,Topwear,Tops,Red,Summer,Casual,Gini and Jony Girls Red Top,1205
43683,Girls,Apparel,Topwear,Tops,Blue,Summer,Casual,Doodle Girls Printed Blue Top,1412
34010,Girls,Apparel,Topwear,Tops,Black,Summer,Casual,Gini and Jony Girls Black Top,1983
3903,Girls,Apparel,Topwear,Tshirts,Yellow,Summer,Casual,Disney Kids Girl's Minnie And Daisy Yellow Kidswear,1213
40159,Girls,Apparel,Topwear,Tops,Pink,Summer,Casual,Gini and Jony Girls Pink Top,1127
3855,Girls,Apparel,Topwear,Tshirts,Red,Summer,Casual,Disney Kids Girl's Red Pretty as a Flower Kidswear,815
18435,Unisex,Accessories,Accessories,Messenger Bag,Black,Fall,Casual,Vital Gear Unisex Black Messenger Bag,1854
3465,Unisex,Apparel,Apparel Set,Swimwear,Black,Fall,Sports,ADIDAS Unisex Black White Swimming Cap,3874
9574,Unisex,Accessories,Bags,Backpacks,Grey,Fall,Casual,Puma Unisex Echo Grey Backpacks,2937
9016,Unisex,Accessories,Belts,Belts,Brown,Winter,Casual,Fastrack Unisex Khaki Brown Canvas Belts,1646
2584,Unisex,Apparel,Bottomwear,Track Pants,Black,Fall,Sports,Kalenji Unisex Tight Black Track Pant,1969
38235,Unisex,Accessories,Eyewear,Sunglasses,Brown,Winter,Casual,Polaroid Unisex Sunglasses,1740
38552,Unisex,Footwear,Flip Flops,Flip Flops,White,Summer,Casual,Puma Unisex  White & Green  Flip Flops,5785
23578,Unisex,Personal Care,Fragrance,Fragrance Gift Set,Black,Spring,Casual,Nike Unisex Set of 3 Fragrance Gift Set,1081
53619,Unisex,Free Items,Free Gifts,Free Gifts,Blue,Winter,Casual,Q&Q Unisex Blue Digital Watch,2145
18903,Unisex,Accessories,Gloves,Gloves,Black,Summer,Casual,ADIDAS Originals Unisex AC Striped Black Gloves,2106
55517,Unisex,Personal Care,Hair,Hair Colour,Black,Spring,Casual,Revlon Top Speed Natural Black Hair Colour Natural Black 70,1951
17950,Unisex,Accessories,Headwear,Caps,Black,Fall,Sports,Nike Unisex Swoosh Black Bandana,1915
40826,Unisex,Home,Home Furnishing,Cushion Covers,Yellow,Fall,Home,Swayam Unisex Yellow and Orange Cushion Covers (Set of 2),1897
14724,Unisex,Accessories,Mufflers,Mufflers,Black,Fall,Casual,Scullers Unisex Casual Muffler Black Mufflers,1982
15857,Unisex,Footwear,Sandal,Sandals,Blue,Spring,Casual,Warner Bros Kids Unisex LT Blug Clog Blue Sandals,1639
17636,Unisex,Accessories,Scarves,Scarves,Purple,Fall,Casual,Puma Unisex Graphic Purple Scarf,1969
6843,Unisex,Accessories,Shoe Accessories,Shoe Accessories,Black,Summer,Casual,Timberland Unisex Suede Restorer Brush Shoe Accessories,2579
21741,Unisex,Footwear,Shoes,Casual Shoes,White,Fall,Casual,Vans Unisex Authentic Lo Pro White Casual Shoes,4077
57625,Unisex,Personal Care,Skin Care,Sunscreen,Orange,Spring,Casual,Lotus Herbals Kids Sun Block Cream,940
37885,Unisex,Accessories,Socks,Socks,Red,Summer,Casual,Happy Socks Unisex Pack of 2 Socks,230
53357,Unisex,Accessories,Sports Accessories,Wristbands,Red,Fall,Sports,Puma Unisex Pack of 2 Red Wristband,2234
1553,Unisex,Sporting Goods,Sports Equipment,Footballs,White,Fall,Sports,Puma Power Cat Hard Ground Football,1941
12834,Unisex,Apparel,Topwear,Tshirts,Blue,Fall,Casual,Ant Unisex Cute Chick Blue Tshirts,1212
23691,Unisex,Accessories,Wallets,Wallets,Black,Fall,Casual,Newhide Black Unisex Travel Pouch Passport Holder,1494
16784,Unisex,Accessories,Watches,Watches,Black,Winter,Casual,ADIDAS Originals Unisex Black Dial Chronograph Watch ADH2584,4474
1554,Unisex,Accessories,Water Bottle,Water Bottle,Blue,Fall,Casual,Quechua  Blue Sipper,2895
8934,Unisex,Sporting Goods,Wristbands,Wristbands,Black,Fall,Casual,Puma Unisex Fundamentals Black Wristbands,1445
9572,Unisex,Accessories,Accessories,Travel Accessory,Black,Fall,Casual,Puma Unisex Big Cat Shoe Bag Black Bags,2622
3464,Unisex,Apparel,Apparel Set,Swimwear,Blue,Winter,Sports,ADIDAS Kid's Light Aqua Swimming Cap,3639
4588,Unisex,Accessories,Bags,Backpacks,Red,Winter,Casual,Wildcraft Unisex Red & Grey Backpack,2313
20983,Unisex,Accessories,Belts,Belts,Black,Winter,Casual,Fastrack Unisex Leatherette Black Belt,2622
1638,Unisex,Apparel,Bottomwear,Swimwear,Blue,Fall,Sports,Nabaiji Swimming Goggles Blue Black,2873
16892,Unisex,Accessories,Eyewear,Sunglasses,Black,Winter,Casual,Police Unisex Casual Black Sunglasses,1096
15878,Unisex,Footwear,Flip Flops,Flip Flops,Yellow,Winter,Casual,Warner Bros Kids Unisex TJ Big Face Yellow Slippers,4443
22553,Unisex,Personal Care,Fragrance,Deodorant,Red,Spring,Casual,Reebok Unisex Reezoom Deo,1009
15658,Unisex,Free Items,Free Gifts,Free Gifts,Blue,Winter,Casual,Belkin Unisex Simple Messenger Blue Handbags,1472
12437,Unisex,Accessories,Headwear,Caps,Green,Fall,Casual,Timberland Unisex Casual Green Caps,1649
6130,Unisex,Footwear,Sandal,Sandals,Green,Summer,Casual,Puma Unisex Scuba Black Green Floater,2038
18998,Unisex,Accessories,Scarves,Scarves,Black,Fall,Casual,ADIDAS Originals Unisex Black Scarf,1825
12450,Unisex,Accessories,Shoe Accessories,Shoe Accessories,Brown,Fall,,Timberland Unisex Brown Shoe Accessories,1621
25685,Unisex,Footwear,Shoes,Casual Shoes,Red,Fall,Casual,Converse Unisex Red Casual Shoes,3984
9965,Unisex,Accessories,Sports Accessories,Wristbands,Black,Fall,Sports,ADIDAS Unisex Nba Black Wristbands,1581
4011,Unisex,Sporting Goods,Sports Equipment,Basketballs,Grey,Summer,Sports,Spalding Buror Grey Basketball,1624
3743,Unisex,Apparel,Topwear,Tshirts,Orange,Summer,Casual,Tantra Kid's Gizmo Orange Kidswear,1047
42084,Unisex,Accessories,Wallets,Wallets,Brown,Summer,Casual,American Tourister Unisex Brown Passport Holder,1287
4706,Unisex,Accessories,Watches,Watches,Black,Winter,Sports,ADIDAS Unisex Seoul Black Gold Watch,5806
8936,Unisex,Accessories,Water Bottle,Water Bottle,Black,Summer,Casual,Puma Unisex fundamentals  Black Water Bottle,2314
42830,Unisex,Sporting Goods,Wristbands,Wristbands,Black,Summer,Sports,Nike Unisex Swoosh Black Wristbands,2455
58523,Unisex,Accessories,Accessories,Travel Accessory,Yellow,Summer,Casual,Wildcraft Unisex Yellow Travel Pouch,2577
24809,Unisex,Apparel,Bottomwear,Swimwear,Pink,Fall,Sports,Nabaiji Unisex Pink Swimming Cap,2118
17586,Unisex,Accessories,Eyewear,Sunglasses,White,Summer,Sports,Speedo Unisex Funky Eyewear White Sunglasses,1823
10739,Unisex,Footwear,Flip Flops,Flip Flops,Black,Winter,Casual,Disney Unisex Kids Basic Black Flip Flops,3802
26848,Unisex,Personal Care,Fragrance,Perfume and Body Mist,Cream,Spring,Casual,Calvin Klein Unisex One Perfume,1225
