id,gender,masterCategory,subCategory,articleType,baseColour,season,usage,productDisplayName,price_inr
59748,Women,Apparel,Loungewear and Nightwear,Nightdress,Cream,Summer,Casual,Avirate Cream Nightdress,2601
56601,Women,Personal Care,Makeup,Kajal and Eyeliner,Rose,Spring,Casual,Streetwear Eye Definer Rose Eye Liner 10,1373
20052,Women,Accessories,Mufflers,Mufflers,Yellow,Fall,Casual,United Colors Of Benetton Women Yellow Muffler,1794
55856,Women,Personal Care,Nails,Nail Polish,Red,Spring,Casual,Colorbar Pro Rosie Nail Lacquer 015,1404
27329,Women,Personal Care,Perfumes,Perfume and Body Mist,Orange,Spring,Casual,Jovan Women Musk Perfume,1107
39897,Women,Footwear,Sandal,Sports Sandals,Black,Summer,Casual,ADIDAS Women Black Yorgio Sandals,5869
57966,Women,Apparel,Saree,Sarees,Multi,Fall,Ethnic,Prafful Multi Coloured Sari,4728
25956,Women,Accessories,Scarves,Scarves,Grey,Summer,Casual,Femella Women Grey Scarf,1833
46620,Women,Footwear,Shoes,Heels,Brown,Summer,Casual,Catwalk Women Brown Sandals,5788
57768,Women,Personal Care,Skin,Mask and Peel,White,Spring,,Lotus Herbals Tea Tree Clarifying Face Pack,1235
57782,Women,Personal Care,Skin Care,Face Moisturisers,Cream,Spring,Casual,Lotus Herbals Nutramoist Skin Renewal Daily Cream,1322
19496,Women,Accessories,Socks,Socks,White,Summer,Sports,Puma Women Sport Quarters Pack of 3 Socks,326
34979,Women,Accessories,Stoles,Stoles,Beige,Summer,Ethnic,Fabindia Women Silk Mulberry Printed Beige Stole,2526
2587,Women,Apparel,Topwear,Tshirts,Blue,Summer,Casual,Quechua Women's Blue T-shirt,1088
14872,Women,Accessories,Umbrellas,Umbrellas,Blue,Summer,Casual,United Colors of Benetton Women Printed Blue Umbrellas,1634
45824,Women,Free Items,Vouchers,Ipad,Blue,Summer,Casual,Senorita Women Blue Flats,2384
51893,Women,Accessories,Wallets,Wallets,Red,Summer,Casual,Nyk Women Red Wallet,1542
37331,Women,Accessories,Watches,Watches,Copper,Winter,Casual,DKNY Women Copper-Toned Dial Watch NY8467,5512
14889,Women,Accessories,Accessories,Travel Accessory,Olive,Summer,Casual,United Colors of Benetton Women Solid Olive Bags,2371
21910,Women,Apparel,Apparel Set,Kurta Sets,Red,Fall,Ethnic,Biba Women Red Printed Churidar Kurta with Dupatta,3177
25250,Women,Accessories,Bags,Handbags,Brown,Summer,Casual,Lino Perros Women Brown Handbag,2030
56432,Women,Personal Care,Bath and Body,Nail Essentials,Pink,Spring,Casual,Streetwear Nail Color Remover,1292
55834,Women,Personal Care,Beauty Accessories,Beauty Accessory,Skin,Spring,Casual,Colorbar Miss Reflective Body Shimmer 001,1139
33726,Women,Accessories,Belts,Belts,Grey,Summer,Casual,Pieces Women Grey Belt,2629
11126,Women,Apparel,Bottomwear,Track Pants,Blue,Fall,Sports,Urban Yoga Women Solid Blue Track Pants,2203
58548,Women,Accessories,Cufflinks,Ties and Cufflinks,Brown,Spring,Casual,Miami Blues Women Sunglasses,2457
59971,Women,Apparel,Dress,Dresses,Multi,Fall,Casual,Avirate Multicoloured Dress,3943
55397,Women,Personal Care,Eyes,Mascara,Black,Spring,Casual,Revlon Water Tight Black Mascara,1866
17213,Women,Accessories,Eyewear,Sunglasses,Purple,Winter,Casual,United Colors of Benetton Women Funky Eyewear Purple Sunglasses,1405
33654,Women,Footwear,Flip Flops,Flip Flops,Red,Summer,Casual,Lotto Women Cara II W Red Flip Flops,5212
27311,Women,Personal Care,Fragrance,Deodorant,Yellow,Spring,Casual,ADIDAS Women Free Emotion Deo,1582
51126,Women,Free Items,Free Gifts,Free Gifts,Pink,Summer,Ethnic,Satya Paul Pink Saree,2246
55328,Women,Personal Care,Hair,Hair Colour,Brown,Spring,Casual,Revlon Color 'N Care 2N Brown Black Hair Colour,992
58149,Women,Accessories,Headwear,Caps,Pink,Summer,Casual,Puma Women Pink Sparkle Cat Cap,2110
59742,Women,Apparel,Innerwear,Briefs,Black,Summer,Casual,Avirate Women Black Brief,2217
58041,Women,Accessories,Jewellery,Earrings,Gold,Fall,Casual,Rreverie Gold Colour Earrings,2662
57588,Women,Personal Care,Lips,Lipstick,Brown,Spring,Casual,Lotus Herbals Cinnamon Lipstick 165,1693
52441,Women,Apparel,Loungewear and Nightwear,Nightdress,Pink,Winter,Casual,Red Rose Pink Nightdress,2131
55110,Women,Personal Care,Makeup,Compact,Skin,Spring,Casual,Lakme Perfect Radiance Intense Whitening 05 Compact,934
20055,Women,Accessories,Mufflers,Mufflers,Grey,Fall,Casual,United Colors Of Benetton Women Grey Muffler,1434
55185,Women,Personal Care,Nails,Nail Polish,Lavender,Spring,Casual,Lakme Absolute Fast & Fabulous Purple Plunge Nail Polish 12,1745
27331,Women,Personal Care,Perfumes,Perfume and Body Mist,Black,Spring,Casual,Jovan Women Black Musk Perfume,1930
17965,Women,Footwear,Sandal,Sports Sandals,Black,Fall,Casual,Puma Women Black Sandal,3690
53051,Women,Apparel,Saree,Sarees,Maroon,Fall,Ethnic,FNF Maroon Printed Sari,3525
25937,Women,Accessories,Scarves,Scarves,Blue,Summer,Casual,Femella Women Blue Scarf,2486
54138,Women,Footwear,Shoes,Heels,Black,Winter,Casual,Rocia Women Black Heels,4447
57701,Women,Personal Care,Skin,Face Moisturisers,Cream,Spring,Casual,Lotus Herbals Papayablem Papaya-N-Saffron Anti-Blemish Creme,1537
57629,Women,Personal Care,Skin Care,Face Wash and Cleanser,White,Spring,,Lotus Herbals Sunscreen Face Wash,1416
57906,Women,Accessories,Socks,Socks,White,Summer,Casual,Fruit of the Loom Women White Pack of Three Socks,361
31075,Women,Accessories,Stoles,Stoles,Red,Summer,Ethnic,Fabindia Women Check Red Stole,2270
11368,Women,Apparel,Topwear,Jackets,Black,Fall,Casual,United Colors Of Benetton Women Light Winter Black Jackets,5420
14874,Women,Accessories,Umbrellas,Umbrellas,Purple,Summer,Casual,United Colors of Benetton Women Stripes Purple Umbrellas,2398
50387,Women,Accessories,Watches,Watches,Black,Winter,Casual,Miss Sixty Black Dial Watch,5770
14890,Women,Accessories,Accessories,Travel Accessory,Purple,Summer,Casual,United Colors of Benetton Women Solid Purple Bags,2536
28975,Women,Apparel,Apparel Set,Kurta Sets,Blue,Summer,Ethnic,Biba Women Blue Churidar Kurta with Dupatta,3039
16739,Women,Accessories,Bags,Clutches,Black,Winter,Casual,Spice Art Women Crystal Flower Black Clutch,2041
55836,Women,Personal Care,Bath and Body,Nail Essentials,Blue,Spring,Casual,Colorbar Nail Polish Remover,1292
55119,Women,Personal Care,Beauty Accessories,Beauty Accessory,Burgundy,Spring,Casual,Lakme Dual Sharpener,855
37063,Women,Accessories,Belts,Belts,Black,Summer,Casual,Lino Perros Women Black Belt,1309
28453,Women,Apparel,Bottomwear,Leggings,Maroon,Summer,Casual,Urban Yoga Women Maroon Leggings,2524
48224,Women,Accessories,Eyewear,Sunglasses,Black,Winter,Casual,United Colors of Benetton Women Black Sunglasses,1793
35578,Women,Footwear,Flip Flops,Flip Flops,Red,Summer,Casual,Gliders Women Red Flip Flops,5047
44386,Women,Personal Care,Fragrance,Deodorant,Green,Spring,Casual,Spinz Women Samba Deo,1279
51119,Women,Free Items,Free Gifts,Free Gifts,Purple,Summer,Ethnic,Satya Paul Purple Saree,2153
55335,Women,Personal Care,Hair,Hair Colour,Brown,Spring,Casual,Revlon Colorsilk Brown-Black Hair Colour 2N,1809
21439,Women,Accessories,Headwear,Caps,Purple,Summer,Casual,Roxy Women Be Happy Purple Cap,2626
52465,Women,Apparel,Innerwear,Camisoles,Black,Winter,Casual,Red Rose Black Camisole,3112
59513,Women,Accessories,Jewellery,Pendant,Silver,Summer,Casual,Lucera Silver Pendant With Chain,2734
56118,Women,Personal Care,Lips,Lipstick,Pink,Spring,Casual,Colorbar Coral Crush Lip Pot 006,1974
49784,Women,Apparel,Loungewear and Nightwear,Night suits,White,Summer,Casual,Little Miss Intimates White Printed Pyjama Set,3141
55270,Women,Personal Care,Makeup,Kajal and Eyeliner,Black,Summer,Casual,Lakme Insta-Liner,1963
20064,Women,Accessories,Mufflers,Mufflers,Blue,Fall,Casual,United Colors Of Benetton Women Blue Muffler,1380
55909,Women,Personal Care,Nails,Nail Polish,Black,Spring,Casual,Colorbar Night Fiery Nail Lacquer 75,1736
27330,Women,Personal Care,Perfumes,Perfume and Body Mist,White,Spring,Casual,Jovan Women White Musk Perfume,941
8771,Women,Footwear,Sandal,Sports Sandals,Black,Fall,Casual,Crocs Women Crle Plterm Black Floater,3469
52983,Women,Apparel,Saree,Sarees,Maroon,Fall,Ethnic,FNF Striped Multi Coloured Sari,4421
25932,Women,Accessories,Scarves,Scarves,Black,Summer,Casual,Femella Women Black Scarf,1448
12979,Women,Footwear,Shoes,Sports Shoes,White,Fall,Sports,ADIDAS Women Core 50 White Sports Shoes,5075
59851,Women,Personal Care,Skin,Face Serum and Gel,White,Spring,Casual,Olay Women White Radiance Intensive Brightening Serum,1237
57866,Women,Personal Care,Skin Care,Sunscreen,Yellow,Spring,Casual,Biotique Women Bio Carrot SPF 40 Sunscream,1026
12737,Women,Accessories,Socks,Socks,White,Fall,Sports,Nike Women Sports White Socks,245
35004,Women,Accessories,Stoles,Stoles,Black,Summer,Ethnic,Fabindia Women Printed Black Stole,1287
43084,Women,Apparel,Topwear,Tshirts,Green,Summer,Sports,Nike Women Green T-shirt,1470
19740,Women,Accessories,Umbrellas,Umbrellas,Green,Summer,Casual,United Colors of Benetton Green Graphic Design Umbrella,2913
54400,Women,Accessories,Wallets,Wallets,Teal,Summer,Casual,Baggit Women Teal Wallet,1690
11225,Women,Accessories,Watches,Watches,Steel,Winter,Casual,Esprit Women Cinecitta Black Steel Watches,5826
14893,Women,Accessories,Accessories,Travel Accessory,Blue,Summer,Casual,United Colors of Benetton Women Solid Blue Bags,1325
25594,Women,Apparel,Apparel Set,Kurta Sets,White,Fall,Ethnic,Vishudh Women White and Black Churidar Kurta with Dupatta,2519
24624,Women,Accessories,Bags,Handbags,Green,Winter,Casual,Murcia Women Green Leather Handbag,2515
57681,Women,Personal Care,Bath and Body,Body Lotion,Cream,Spring,,Lotus Herbals Cherry Bliss Body Lotion,1095
55286,Women,Personal Care,Beauty Accessories,Beauty Accessory,Cream,Spring,Casual,Lakme All Over Shimmer Gloss,1225
38409,Women,Accessories,Belts,Belts,Teal,Summer,Casual,Baggit Women Teal Rocker Taj Belt,1474
47049,Women,Apparel,Bottomwear,Salwar,Purple,Fall,Ethnic,Shree Women Red & Blue Jodhpuri Salwar,1954
54973,Women,Apparel,Dress,Dresses,Off White,Summer,Casual,Femella Women Off White Dress,2061
56161,Women,Personal Care,Eyes,Kajal and Eyeliner,Brown,Spring,Casual,Colorbar I-Glide Cocobar Eye Pencil 02,1225
17315,Women,Accessories,Eyewear,Sunglasses,Black,Winter,Casual,Pepe Jeans Women Casual Sunglasses,1401
26676,Women,Footwear,Flip Flops,Flip Flops,Pink,Summer,Casual,Puma Women Stawberry Pink Flip Flops,4122
43975,Women,Personal Care,Fragrance,Perfume and Body Mist,Brown,Spring,Casual,DKNY Women Be Delicious Perfume,1162
48331,Women,Free Items,Free Gifts,Free Gifts,Bronze,Summer,Casual,Pitaraa Women Bronze Clutch,2238
55326,Women,Personal Care,Hair,Hair Colour,Brown,Spring,Casual,Revlon Color N Care 3N Darkest Brown Permanent Hair Colour Cream,858
17956,Women,Accessories,Headwear,Caps,Purple,Fall,Sports,Nike Women Stay Cool Purple Cap,1956
21615,Women,Apparel,Innerwear,Bra,Purple,Summer,Casual,Enamor Women Smooth Purple Bra,3118
52825,Women,Accessories,Jewellery,Earrings,Green,Summer,Casual,Adrika Black & Green Earrings,2584
56114,Women,Personal Care,Lips,Lip Gloss,Rose,Spring,Casual,Colorbar Feelin Rosey Lip Pot 011,1990
55823,Women,Apparel,Loungewear and Nightwear,Night suits,Pink,Summer,Casual,SDL by Sweet Dreams Women Pink Printed Night Suit S11-3240,2723
56178,Women,Personal Care,Makeup,Concealer,Beige,Spring,Casual,Colorbar Sand Beige Concealer 003,1929
20050,Women,Accessories,Mufflers,Mufflers,Purple,Fall,Casual,United Colors of Benetton Women Solid Purple Muffler,2852
57640,Women,Personal Care,Nails,Nail Polish,Bronze,Spring,,Lotus Herbals Colour Dew Bronze Rain Nail Polish 914,991
31957,Women,Footwear,Shoes,Sports Shoes,White,Summer,Sports,Nike Women White Sports Shoes,4376
57674,Women,Personal Care,Skin,Face Moisturisers,White,Spring,,Lotus Herbals Whiteglow Hand & Body Lotion,1091
57616,Women,Personal Care,Skin Care,Sunscreen,White,Spring,,Lotus Herbals Intensive Sunblock Spray,1756
43554,Women,Accessories,Socks,Socks,Cream,Summer,Casual,Puma Women Cream Socks,347
31085,Women,Accessories,Stoles,Stoles,Brown,Summer,Ethnic,Fabindia Women Brown Ekko Silk Stole,2952
1809,Women,Apparel,Topwear,Tshirts,Blue,Fall,Sports,Decathlon Profilter Women Blue T-shirt,826
14875,Women,Accessories,Umbrellas,Umbrellas,Purple,Summer,Casual,United Colors of Benetton Women Printed Purple Umbrellas,2003
17089,Women,Accessories,Wallets,Wallets,Blue,Winter,Casual,Lino Perros Women Blue Zip Blue Wallet,1883
40546,Women,Accessories,Watches,Watches,Black,Winter,Casual,Titan Raga Women Black Dial Watch,5656
58600,Women,Accessories,Accessories,Hair Accessory,Pink,Winter,Casual,ToniQ Women Pink Hair Accessories,2175
39135,Women,Apparel,Apparel Set,Kurta Sets,Brown,Summer,Ethnic,Aneri Women Printed Brown Salwar Suit,3021
27711,Women,Accessories,Bags,Handbags,Green,Winter,Casual,Murcia Women Green Handbag,1716
57687,Women,Personal Care,Bath and Body,Body Lotion,White,Spring,,Lotus Herbals Vanilla Velvet Body Lotion,1930
50231,Women,Accessories,Eyewear,Sunglasses,Lavender,Winter,Casual,Stoln Women Lavender Sunglasses,1296
49836,Women,Footwear,Flip Flops,Flip Flops,Gold,Winter,Casual,iPanema Women Gold Flip Flops,4026
46945,Women,Personal Care,Fragrance,Perfume and Body Mist,Black,Spring,Casual,York Women Diamond Perfume,1096
43285,Women,Free Items,Free Gifts,Backpacks,Black,Summer,Casual,Murcia Women Black Backpack,1866
55330,Women,Personal Care,Hair,Hair Colour,Brown,Spring,Casual,Revlon Colorsilk 4N Medium Brown Hair Colour,1272
16535,Women,Accessories,Headwear,Caps,Grey,Fall,Casual,Probase Women Check Grey Cap,1701
59752,Women,Apparel,Innerwear,Briefs,Cream,Summer,Casual,Avirate Cream Brief,2755
43858,Women,Accessories,Jewellery,Earrings,Green,Summer,Ethnic,Royal Diadem Green Earrings,2706
55427,Women,Personal Care,Lips,Lipstick,Pink,Spring,Casual,Revlon Moisture Stay Mica Lipstick 15,1816
52419,Women,Apparel,Loungewear and Nightwear,Nightdress,Coffee Brown,Winter,Casual,Red Rose Women Coffee Brown Nightdress,3117
55549,Women,Personal Care,Makeup,Kajal and Eyeliner,Brown,Spring,Casual,Revlon Sparkling Brown Eyeliner,1475
20054,Women,Accessories,Mufflers,Mufflers,Black,Fall,Casual,United Colors Of Benetton Women Black Muffler,2301
55846,Women,Personal Care,Nails,Nail Polish,Pink,Spring,Casual,Colorbar Pro Pleasing Pink Nail Lacquer 049,1418
23893,Women,Footwear,Sandal,Sports Sandals,Pink,Fall,Casual,Fila Women Shelby Pink Sports Sandals,2979
45986,Women,Apparel,Saree,Sarees,Black,Summer,Ethnic,Fabindia Black Mangalagiri Saree,3496
25933,Women,Accessories,Scarves,Scarves,Brown,Summer,Casual,Femella Women Brown Scarf,2084
45366,Women,Footwear,Shoes,Heels,Brown,Summer,Casual,Cobblerz Women Brown Sandals,2988
57885,Women,Personal Care,Skin,Mask and Peel,Green,Spring,Casual,Biotique Bio Mud Ageless Firming & Revitalizing Face Pack,980
55583,Women,Personal Care,Skin Care,Face Wash and Cleanser,Gold,Spring,,Revlon Age Defying Sculpt-Logic Gentle Cream Cleanser,1561
29216,Women,Accessories,Socks,Socks,White,Fall,Sports,Fila Women White Socks,388
34974,Women,Accessories,Stoles,Stoles,Multi,Summer,Ethnic,Fabindia Women Chanderi Multi Coloured Stole,1305
54899,Women,Apparel,Topwear,Tops,Yellow,Summer,Casual,Do u speak green Women Yellow Top,1611
14873,Women,Accessories,Umbrellas,Umbrellas,Purple,Summer,Casual,United Colors of Benetton Women Printed Purple Umbrellas,2038
20466,Women,Accessories,Wallets,Wallets,Beige,Winter,Casual,Baggit Women Udaan Jhuti Beige Wallet,1313
22933,Women,Accessories,Watches,Watches,White,Winter,Casual,Fastrack Women White Casual Watch,6142
43920,Women,Apparel,Dress,Dresses,Cream,Summer,Casual,Femella Women Cream Printed Dress,3423
49137,Women,Personal Care,Eyes,Kajal and Eyeliner,Blue,Spring,Casual,Deborah 24 Ore Eye Pencil 267,1922
17328,Women,Accessories,Eyewear,Sunglasses,Brown,Winter,Casual,Pepe Jeans Women Casual Sunglasses,1649
6452,Women,Footwear,Flip Flops,Flip Flops,Red,Summer,Casual,Lotto Women's Safina Red Flip Flop,5074
25981,Women,Personal Care,Fragrance,Perfume and Body Mist,Turquoise Blue,Spring,Casual,J.Del Pozo Quasar Women Perfume,1250
51090,Women,Free Items,Free Gifts,Free Gifts,Red,Summer,Ethnic,Satya Paul Red & Grey Saree,2315
55331,Women,Personal Care,Hair,Hair Colour,Brown,Spring,Casual,Revlon Women Color Silk Dark Mahogany Brown Hair Colour 3RB,1554
2589,Women,Accessories,Headwear,Caps,Maroon,Summer,Casual,Quechua Women Maroon Cap,1448
27400,Women,Apparel,Innerwear,Bra,Nude,Summer,Casual,Jockey Essence Nude-Coloured Full-Coverage Cross Over Bra 1242,2177
58022,Women,Accessories,Jewellery,Earrings,Silver,Fall,Casual,Rreverie Silver Earrings,1658
56073,Women,Personal Care,Lips,Lip Liner,Brown,Spring,Casual,Colorbar Very Cherry Lip Liner /Crayon 010,1542
49779,Women,Apparel,Loungewear and Nightwear,Night suits,White,Summer,Casual,Little Miss Intimates White Printed Pyjama Set,2959
55272,Women,Personal Care,Makeup,Kajal and Eyeliner,Black,Spring,Casual,Lakme Women Absolute Precision Liquid Eye Liner,1206
20063,Women,Accessories,Mufflers,Mufflers,Black,Fall,Casual,United Colors Of Benetton Women Black Muffler,2630
55354,Women,Personal Care,Nails,Nail Polish,Beige,Spring,Casual,Revlon Sand Mist Nail Polish 394,1638
4101,Women,Footwear,Sandal,Sports Sandals,Green,Summer,Sports,Puma Women Green Navy Baby Blue Floater,3201
52917,Women,Apparel,Saree,Sarees,Orange,Fall,Ethnic,FNF Orange Printed Sari,6179
47653,Women,Accessories,Scarves,Scarves,Yellow,Summer,Casual,Femella Women Yellow & Grey Scarf,1787
43937,Women,Footwear,Shoes,Heels,Black,Winter,Casual,Catwalk Women Black & Pink Heels,4263
57888,Women,Personal Care,Skin,Mask and Peel,Lavender,Spring,Casual,Biotique Women Bio Clove Anti Blemish Face Pack,1041
55100,Women,Personal Care,Skin Care,Face Moisturisers,Silver,Spring,Casual,Ponds Age Miracle Cell ReGen Day Cream SPF 15 10 G,1300
43556,Women,Accessories,Socks,Socks,Black,Summer,Casual,Puma Women Black Pack of 2 Socks,248
35013,Women,Accessories,Stoles,Stoles,Rust,Summer,Ethnic,Fabindia Women Printed Rust Stole,2531
17608,Women,Apparel,Topwear,Tshirts,Pink,Fall,Casual,Doodle Sporty Girl dark Pink Tshirts,1204
19739,Women,Accessories,Umbrellas,Umbrellas,Blue,Summer,Casual,United Colors of Benetton Women Stripes Blue Black Umbrella,2790
48173,Women,Accessories,Wallets,Wallets,Multi,Winter,Casual,Fossil Women Multi Coloured Wallet,1521
8132,Women,Accessories,Watches,Watches,White,Winter,Casual,Fastrack Women Core Analog White Steel Watch,5340
21915,Women,Apparel,Apparel Set,Kurta Sets,Orange,Fall,Ethnic,Biba Women Orange & Purple Printed Churidar Kurta with Dupatta,2797
37074,Women,Accessories,Bags,Handbags,Black,Summer,Casual,Lino Perros Women Black Handbag,2215
55197,Women,Personal Care,Bath and Body,Nail Essentials,Purple,Spring,Casual,Lakme Nail Colour Remover,1712
20536,Women,Accessories,Belts,Belts,Blue,Winter,Casual,Baggit Women Flora Astro Blue Belt,1971
51600,Women,Apparel,Bottomwear,Jeans,Blue,Summer,Casual,Wrangler Women Blue Molly Jeans,3464
49630,Women,Apparel,Dress,Dresses,Blue,Summer,Casual,Mineral Blue Dress,2592
49098,Women,Personal Care,Eyes,Eyeshadow,Green,Spring,Casual,Deborah HiTech Trio Eye Shadow 10,977
23736,Women,Accessories,Eyewear,Sunglasses,Red,Winter,Casual,Ray-Ban Women Jackie Sunglasses,1783
19125,Women,Footwear,Flip Flops,Flip Flops,Blue,Fall,Casual,Lotto Women XL Kelly Blue Slippers,4458
23583,Women,Personal Care,Fragrance,Deodorant,Pink,Spring,Casual,Nike Fragrances Women Trendy Deo,1118
29975,Women,Free Items,Free Gifts,Free Gifts,Black,Winter,Casual,Aspen Women Black Dial Watch,2108
55325,Women,Personal Care,Hair,Hair Colour,Brown,Spring,Casual,Revlon Colorsilk Luminista Golden Brown Hair Colour 120,1569
40744,Women,Accessories,Headwear,Caps,Blue,Winter,Casual,Roxy Women Blue Cap,1677
53476,Women,Apparel,Innerwear,Bra,Mushroom Brown,Summer,Casual,Amante Mushroom Brown Medium-Coverage Bra BCSB01,2134
48610,Women,Accessories,Jewellery,Earrings,Silver,Summer,Casual,Lucera Women Silver Earrings,2982
55027,Women,Personal Care,Lips,Lipstick,Pink,Spring,Casual,Lakme Absolute Matte Pink Princess Lipstick 204,1044
51982,Women,Apparel,Loungewear and Nightwear,Nightdress,Pink,Summer,Casual,Inaya Women Bright Pink Nightdress,2484
49094,Women,Personal Care,Makeup,Kajal and Eyeliner,Purple,Spring,Casual,Deborah Kajal 119,1295
20053,Women,Accessories,Mufflers,Mufflers,Blue,Fall,Casual,United Colors Of Benetton Women Blue Muffler,2755
55941,Women,Personal Care,Nails,Nail Polish,Pink,Spring,Casual,Colorbar Whisper Pink Nail Lacquer 18,1154
15303,Women,Footwear,Sandal,Sports Sandals,Beige,Fall,Casual,ADIDAS Women Hispana Beige Sandals,3469
50854,Women,Apparel,Saree,Sarees,White,Summer,Ethnic,Prafful White & Red Sari,3593
35097,Women,Accessories,Scarves,Scarves,Pink,Winter,Casual,Allen Solly Women Pink  Scarf,2578
9206,Women,Footwear,Shoes,Casual Shoes,White,Fall,Casual,Puma Women Corsica Tribal White Casual Shoes,4585
59853,Women,Personal Care,Skin,Face Moisturisers,White,Spring,Casual,Olay Women Natural White Rich All in One Fairness Night Cream,939
55081,Women,Personal Care,Skin Care,Face Wash and Cleanser,Pink,Spring,Casual,Ponds White Beauty Daily Spot-less Lightening Facial Foam,1361
9363,Women,Accessories,Socks,Socks,White,Fall,Casual,Puma Women Logo Stud White Socks,396
50849,Women,Accessories,Stoles,Stoles,Blue,Summer,Casual,Fabindia Women Blue Stole,2863
24515,Women,Apparel,Topwear,Kurtas,Orange,Fall,Ethnic,Mother Earth Women Orange Printed Kurta,2373
11306,Women,Apparel,Bottomwear,Jeans,Blue,Fall,Casual,Wrangler Women Blue Sophia Jeans,2656
5007,Women,Apparel,Dress,Dresses,Purple,Summer,Casual,Gini and Jony Girl's Sandra Purple Kidswear,3197
56154,Women,Personal Care,Eyes,Kajal and Eyeliner,Black,Spring,Casual,Colorbar I-Glide Coal Mine Eye Pencil 09,1428
38208,Women,Accessories,Eyewear,Sunglasses,Grey,Winter,Casual,Polaroid Women Sunglasses,1967
49825,Women,Footwear,Flip Flops,Flip Flops,Yellow,Winter,Casual,iPanema Women Yellow Flip Flops,2797
18450,Women,Personal Care,Fragrance,Perfume and Body Mist,White,Spring,Casual,Ed Hardy Life Love & Luck by Christian Audigier for Women Perfume,1193
18434,Women,Free Items,Free Gifts,Laptop Bag,Purple,Summer,Casual,Vital Gear Women Purple Laptop Bag,2029
55514,Women,Personal Care,Hair,Hair Colour,Brown,Spring,Casual,Revlon ColorSilk Luminista Natural Brown Hair Colour 115,1683
20061,Women,Accessories,Headwear,Caps,Grey,Fall,Casual,United Colors of Benetton Women Solid Grey Cap,2558
59702,Women,Apparel,Innerwear,Shapewear,Black,Summer,Casual,Avirate Black Wired Corset Shapewear,3394
58606,Women,Accessories,Jewellery,Earrings,Gold,Winter,Casual,ToniQ Women Gold Earrings,2242
49149,Women,Personal Care,Lips,Lip Liner,Brown,Spring,Casual,Deborah Extra Lip Liner 02,1474
36280,Women,Apparel,Loungewear and Nightwear,Night suits,Blue,Summer,Casual,SDL by Sweet Dreams Women Blue Night suits,2384
57780,Women,Personal Care,Makeup,Kajal and Eyeliner,Black,Spring,,Lotus Herbals Make-Up Hypnotica Eye Contour Definer Onyx 14,1845
20051,Women,Accessories,Mufflers,Mufflers,Blue,Fall,Casual,United Colors Of Benetton Women Blue Muffler,1993
55857,Women,Personal Care,Nails,Nail Polish,Red,Spring,Casual,Colorbar Pro Kiss Me Darling Nail Lacquer 014,1247
8765,Women,Footwear,Sandal,Sports Sandals,Black,Fall,Casual,Crocs Women Band Wedge Black Floater,5333
50875,Women,Apparel,Saree,Sarees,Green,Fall,Ethnic,Prafful Green & Maroon Printed Sari,5925
59901,Women,Accessories,Scarves,Scarves,Grey,Summer,Casual,Femella Women Grey Scarf,1803
14452,Women,Footwear,Shoes,Heels,Black,Summer,Casual,Enroute Women Casual Black Flats,2825
57700,Women,Personal Care,Skin,Face Moisturisers,White,Spring,,Lotus Herbals Papayablem Anti-Blemish Creme,838
55337,Women,Personal Care,Skin Care,Toner,Gold,Spring,Casual,Revlon Age Defying Sculpt -Logic Re-shaping Toner,1824
32172,Women,Accessories,Socks,Socks,Lavender,Summer,Casual,Playboy Women Lavender Socks,233
31890,Women,Accessories,Stoles,Stoles,Blue,Summer,Ethnic,Fabindia Women Blue Ekko Silk Stole,2301
33563,Women,Apparel,Topwear,Tshirts,Yellow,Summer,Casual,Wrangler Women Butterfly Yellow T-shirt,1206
47323,Women,Accessories,Wallets,Wallets,Purple,Summer,Casual,Baggit Women Purple Shell Baby Wallet,1639
25308,Women,Accessories,Watches,Watches,Blue,Winter,Casual,CASIO Enticer Women Blue Dial Watch (A533) LTP-2069D-2AVDF,4836
28986,Women,Apparel,Apparel Set,Kurta Sets,Orange,Summer,Ethnic,Biba Outlet Women Orange & White Printed Churidar Kurta with Dupatta,2677
10320,Women,Accessories,Bags,Handbags,White,Winter,Casual,Murcia Women Mary White Handbags,2255
55352,Women,Personal Care,Bath and Body,Nail Essentials,White,Spring,Casual,Revlon Extra Fast Nail Polish Remover,1831
17144,Women,Accessories,Belts,Belts,Grey,Winter,Casual,Lino Perros Women Solid Grey Belt,2851
23046,Women,Apparel,Bottomwear,Leggings,Black,Fall,Casual,Arrow Woman Black Printed Jeggings,1836
43303,Women,Apparel,Dress,Dresses,Black,Summer,Casual,United Colors of Benetton Women Black Dress,2885
56152,Women,Personal Care,Eyes,Kajal and Eyeliner,Purple,Spring,Casual,Colorbar I-Glide Amethyst Spark Eye Pencil 011,1173
16079,Women,Accessories,Eyewear,Sunglasses,Brown,Winter,Casual,Mayhem Women Oval Sunglasses 9002-201,1778
20953,Women,Footwear,Flip Flops,Flip Flops,Green,Fall,Casual,ADIDAS Women Spring Green Flip Flops,3873
58973,Women,Personal Care,Fragrance,Perfume and Body Mist,Pink,Spring,Casual,Colour Me Women Pink Perfume,1396
51081,Women,Free Items,Free Gifts,Free Gifts,Yellow,Summer,Ethnic,Satya Paul Yellow & Black Saree,2522
55513,Women,Personal Care,Hair,Hair Colour,Brown,Spring,Casual,Revlon ColorSilk Luminista Golden Brown Hair Colour 120,1572
33775,Women,Accessories,Headwear,Caps,Pink,Summer,Casual,Puma Women Conrad Reversible Pink Beanie Cap,2548
21650,Women,Apparel,Innerwear,Bra,Black,Fall,Casual,Enamor Women Classique Black Bra,2704
52320,Women,Accessories,Jewellery,Bangle,Cream,Winter,Casual,ToniQ Women Cream Bangle,2194
55992,Women,Personal Care,Lips,Lipstick,Brown,Spring,Casual,Colorbar Velvet Matte Verve Lipstick 15 BR,1147
52391,Women,Apparel,Loungewear and Nightwear,Nightdress,Lavender,Winter,Casual,Red Rose Women Lavender Nightdress,3491
