id,gender,masterCategory,subCategory,articleType,baseColour,season,usage,productDisplayName,price_inr
31204,Men,Accessories,Accessories,Accessory Gift Set,Brown,Summer,Casual,Cabarelli Men Brown Accessory Gift Set,2441
29006,Men,Accessories,Bags,Backpacks,Black,Summer,Casual,Cabarelli Men Black Backpack,1584
44016,Men,Personal Care,Bath and Body,Body Wash and Scrub,Silver,Spring,Casual,BOSS Men Selection Shower Gel,1086
41243,Men,Accessories,Belts,Belts,Black,Summer,Casual,Arrow Men Black Belt,1567
14028,Men,Apparel,Bottomwear,Tracksuits,Black,Fall,Casual,Nike Men Solid Black Tracksuits,1999
24645,Men,Accessories,Cufflinks,Cufflinks,Navy Blue,Summer,Formal,Reid & Taylor Men Navy Blue Silk Knot Cufflinks,2669
51663,Men,Accessories,Eyewear,Sunglasses,Green,Winter,Casual,Louis Philippe Men Green Sunglasses,1919
30242,Men,Footwear,Flip Flops,Flip Flops,Navy Blue,Summer,Casual,Numero Uno Men Navy Blue Flip Flops,3647
43104,Men,Personal Care,Fragrance,Deodorant,Brown,Spring,Casual,Reebok Men Reemystify Deo,1788
25088,Men,Free Items,Free Gifts,Wallets,Black,Summer,Casual,Lino Perros Men Leather Black Wallet,2820
19442,Men,Accessories,Gloves,Gloves,Black,Summer,Casual,Quiksilver Men Black Octo Gloves,2144
18211,Men,Accessories,Headwear,Caps,Red,Fall,Casual,Manchester United Men Printed Red Cap,1673
13617,Men,Apparel,Innerwear,Innerwear Vests,Black,Summer,Casual,Hanes Men Black V DuoDry Body Fit V-Neck T-shirt,641
48962,Men,Accessories,Jewellery,Ring,Steel,Summer,Casual,Revv Men Steel Ring,1619
41694,Men,Apparel,Loungewear and Nightwear,Lounge Pants,Black,Summer,Casual,Superman Men Black Printed Lounge Pants,3410
13531,Men,Accessories,Mufflers,Mufflers,Black,Fall,Casual,Scullers Red Stripe Muffler,2349
44030,Men,Personal Care,Perfumes,Perfume and Body Mist,Orange,Spring,Casual,dunhill Men Pursuit Perfume,1914
26706,Men,Footwear,Sandal,Sandals,White,Fall,Casual,Nike Men Bennasi Solarsift White Sandals,1650
16012,Men,Accessories,Scarves,Scarves,White,Fall,Casual,Turtle Check Men White Scarf,2646
22233,Men,Accessories,Shoe Accessories,Shoe Accessories,Black,Fall,,Timberland Men Black Shoe Laces,2153
3556,Men,Footwear,Shoes,Casual Shoes,Brown,Winter,Casual,Skechers Men Dark Brown Lifestyle Shoe,3501
56365,Men,Personal Care,Skin Care,Mens Grooming Kit,Gold,Spring,Casual,Baldessarini Men Strictly Private 90 ml After Shave Lotion,1023
18951,Men,Accessories,Socks,Socks,Black,Summer,Casual,Levis Men Full Cushion Crew Pack of 3 Socks,301
12465,Men,Accessories,Stoles,Stoles,Black,Fall,Casual,Basics Men Black Checked Stoles,2266
58891,Men,Accessories,Ties,Ties,Lavender,Summer,Casual,Hakashi Men Lavender Tie,1567
26057,Men,Apparel,Topwear,Shirts,Purple,Summer,Formal,John Miller Men Check Purple Shirt,1590
31188,Men,Accessories,Wallets,Wallets,Black,Summer,Casual,Cabarelli Men Black Wallet,2070
23282,Men,Accessories,Watches,Watches,Off White,Winter,Casual,Maxima Men Off White Dial Watch,5939
1596,Men,Accessories,Water Bottle,Water Bottle,Pink,Fall,Sports,Quechua Easy-to-Carry Pink Sipper,2856
25059,Men,Accessories,Accessories,Accessory Gift Set,Purple,Winter,Formal,Lino Perros Men Formal Purple Accessory Gift Set,2341
28922,Men,Accessories,Bags,Backpacks,Black,Summer,Casual,Cabarelli Men Black Backpack,2875
38562,Men,Apparel,Bottomwear,Shorts,Black,Summer,Sports,Nike Men Varsity Black Shorts,1867
59582,Men,Accessories,Cufflinks,Cufflinks,Steel,Summer,Casual,Revv Men Black Cufflinks,1626
28412,Men,Accessories,Eyewear,Sunglasses,Black,Winter,Casual,Idee Men Black Sunglasses,1859
40785,Men,Footwear,Flip Flops,Flip Flops,White,Summer,Casual,Quiksilver Men White Flip Flops,5123
44027,Men,Personal Care,Fragrance,Deodorant,Blue,Spring,Casual,Hugo Boss Men Deo,1154
36763,Men,Free Items,Free Gifts,Free Gifts,Green,Winter,Casual,Maxima Men Green Dial Watch,2669
19544,Men,Accessories,Gloves,Gloves,Green,Fall,Casual,United Colors of Benetton Men Solid Green Gloves,2762
19440,Men,Accessories,Headwear,Caps,Red,Summer,Casual,Quiksilver Men Red Qsacc Cap,1769
15904,Men,Apparel,Innerwear,Briefs,Maroon,Summer,Casual,Facit Men Maroon Comfort Briefs,2923
48958,Men,Accessories,Jewellery,Ring,Steel,Summer,Casual,Revv Men Steel Ring,1369
56266,Men,Apparel,Loungewear and Nightwear,Night suits,Grey,Summer,Casual,SDL by Sweet Dreams Men Grey & Black Pyjama Set,3050
13804,Men,Accessories,Mufflers,Mufflers,Grey,Summer,Casual,Proline Grey Checked Muffler,1661
36710,Men,Accessories,Perfumes,Perfume and Body Mist,Red,Spring,Casual,Ferrari Men Perfume,2586
4647,Men,Footwear,Sandal,Sandals,Blue,Summer,Sports,ADIDAS Men Neo Feather Lead Red Sandal,1585
23468,Men,Accessories,Scarves,Scarves,Brown,Winter,Casual,Lino Perros Men Brown Check Scarf,1792
22232,Men,Accessories,Shoe Accessories,Shoe Accessories,Brown,Fall,,Timberland Men Brown Shoe Laces,1269
12891,Men,Footwear,Shoes,Casual Shoes,White,Fall,Casual,Puma Men Basket Team Mesh White Casual Shoes,2854
57622,Men,Personal Care,Skin Care,Sunscreen,White,Spring,,Lotus Herbals Safe Sun Sunscreen for Men,1410
46866,Men,Accessories,Socks,Socks,Black,Spring,Casual,Lino Perros Men Pack Of Two Socks,295
12463,Men,Accessories,Stoles,Stoles,Blue,Fall,Casual,Basics Men Blue Checked Stoles,1468
18767,Men,Accessories,Ties,Ties,Purple,Summer,Formal,Peter England Men Elite Purple Tie,1696
27590,Men,Apparel,Topwear,Tshirts,Blue,Summer,Casual,Scullers Men White & Blue T-shirt,786
25098,Men,Accessories,Wallets,Wallets,Brown,Winter,Casual,Lino Perros Men Leather Dark Brown Wallet,1912
46474,Men,Accessories,Watches,Watches,Black,Winter,Casual,Timex Men Black Dial Watch L506,5344
8221,Men,Accessories,Bags,Backpacks,Navy Blue,Winter,Casual,Fastrack Men Navy Blue Backpack,2142
21766,Men,Accessories,Belts,Belts,Brown,Fall,Casual,Fossil Men Marcus Brown Belt,2709
7687,Men,Apparel,Bottomwear,Shorts,White,Fall,Sports,Puma Men's Long Logo Bermuda White Short,1625
14140,Men,Accessories,Cufflinks,Cufflinks,Steel,Fall,Formal,Belmonte Men Bright Assorted Steel Cufflinks,1710
16846,Men,Accessories,Eyewear,Sunglasses,Brown,Winter,Casual,Idee Men Funky Eyewear Brown Sunglasses,1802
18908,Men,Footwear,Flip Flops,Flip Flops,Blue,Fall,Casual,ADIDAS Men Adi Linear Blue Flip Flops,4372
26853,Men,Personal Care,Fragrance,Perfume and Body Mist,Grey,Spring,Casual,Calvin Klein Men Eternity Perfume,1716
30029,Men,Free Items,Free Gifts,Free Gifts,White,Winter,Casual,Kenneth Cole Men White Dial Watch,2293
19545,Men,Accessories,Gloves,Gloves,Grey,Fall,Casual,United Colors of Benetton Men Solid Grey Gloves,2011
49794,Men,Accessories,Headwear,Caps,Black,Summer,Casual,Flying Machine Men Black Cap,1939
50608,Men,Apparel,Innerwear,Briefs,Grey Melange,Winter,Casual,Chromozome Men Grey Melange Brief,1774
48964,Men,Accessories,Jewellery,Ring,Steel,Summer,Casual,Revv Men Steel Ring,2067
50648,Men,Apparel,Loungewear and Nightwear,Lounge Pants,Black,Fall,Casual,Chromozome Men Black Lounge Pants S-4801,3142
25400,Men,Accessories,Mufflers,Mufflers,Red,Summer,Casual,Nike Men Red Football Club Muffler,2904
44017,Men,Personal Care,Perfumes,Perfume and Body Mist,Grey,Spring,Casual,Boss Men Selection 50 ml Perfume,1338
44552,Men,Footwear,Sandal,Sandals,Brown,Summer,Casual,Coolers Men Brown Sandals,1930
16017,Men,Accessories,Scarves,Scarves,Black,Fall,Casual,Turtle Check Men Black Scarf,2155
19500,Men,Accessories,Socks,Socks,White,Summer,Sports,Puma Men Sport Quarters White Socks,283
12464,Men,Accessories,Stoles,Stoles,Cream,Fall,Casual,Basics Men Cream-Coloured Checked Stoles,2259
50280,Men,Accessories,Ties,Ties,Blue,Summer,Formal,Parx Men Light Blue Tie,1367
14078,Men,Apparel,Topwear,Tshirts,Grey,Fall,Casual,Flying Machine Men Solid Grey Polo Tshirts,1133
41267,Men,Accessories,Wallets,Wallets,Black,Summer,Casual,Arrow Men Black Wallet,2314
51648,Men,Accessories,Watches,Watches,Black,Winter,Casual,Fossil Men Black Dial Chronograph Watch FS4657,6000
17379,Men,Accessories,Accessories,Accessory Gift Set,Blue,Fall,Formal,Arrow Men Formal Blue Tie+Cufflink+Pocket square - Combo Pack,1998
5856,Men,Accessories,Bags,Handbags,Brown,Summer,Casual,ADIDAS Men Organizer Brown Sling Bag,1956
34800,Men,Accessories,Belts,Belts,Black,Summer,Casual,Flying Machine Men Woven Black Belt,1254
12678,Men,Apparel,Bottomwear,Trousers,Black,Fall,Casual,Probase Men Check Black Trousers,3103
59569,Men,Accessories,Cufflinks,Cufflinks,Steel,Summer,Casual,Revv Men Purple Cufflinks,1380
51664,Men,Accessories,Eyewear,Sunglasses,Grey,Winter,Casual,Louis Philippe Men Oversized Sunglasses LP214-C1,1468
24178,Men,Footwear,Flip Flops,Flip Flops,Black,Fall,Casual,Converse Men Arrow  Black Flip Flops,3738
23546,Men,Personal Care,Fragrance,Perfume and Body Mist,Blue,Spring,Casual,Police Cosmopolitian Men Perfume,1812
53592,Men,Free Items,Free Gifts,Free Gifts,White,Winter,Casual,Q&Q Men White Dial Watch,2918
19541,Men,Accessories,Gloves,Gloves,Black,Fall,Casual,United Colors of Benetton Men Solid Black Gloves,1803
13722,Men,Accessories,Headwear,Caps,Navy Blue,Fall,Casual,Proline Men Navy & White Patterned Beanie,2819
28012,Men,Apparel,Innerwear,Trunk,Black,Winter,Casual,Jockey ZONE STRETCH Men Black Trunks US20,2491
48739,Men,Accessories,Jewellery,Bangle,Steel,Summer,Casual,Revv Men Steel Bangle,2669
18135,Men,Apparel,Loungewear and Nightwear,Lounge Shorts,Grey,Summer,Casual,Crusoe Men Sport Dark Grey Shorts,3541
17384,Men,Accessories,Mufflers,Mufflers,Cream,Fall,Casual,Reid & Taylor Men Check Cream Muffler,2394
20215,Men,Apparel,Topwear,Sweaters,Blue,Fall,Casual,Wrangler Men Flag Blue Sweater,1896
52808,Men,Accessories,Wallets,Wallets,Black,Summer,Casual,JAG Men Black Leather Wallet,1485
33902,Men,Accessories,Watches,Watches,Black,Summer,Casual,Citizen Men Black Dial Watch BH1370-51E,4754
17375,Men,Accessories,Accessories,Accessory Gift Set,Purple,Fall,Formal,Arrow Men Formal Purple Tie+Cufflink+Pocket square - Combo Pack,1509
12348,Men,Accessories,Bags,Handbags,Green,Spring,Travel,test dispName,2809
8311,Men,Accessories,Belts,Belts,Brown,Winter,Casual,Fastrack Men Light Brown Belt,1558
16224,Men,Apparel,Bottomwear,Tracksuits,Navy Blue,Fall,Sports,Puma Men Poly Knitted Navy Blue Tracksuit,1734
59568,Men,Accessories,Cufflinks,Cufflinks,Steel,Summer,Casual,Revv Men Black Cufflinks,2225
30675,Men,Accessories,Eyewear,Sunglasses,Steel,Winter,Casual,Park Avenue Men Steel Sunglasses,1404
53882,Men,Footwear,Flip Flops,Flip Flops,White,Summer,Casual,U.S. Polo Assn. Men White Flip Flops,5539
26189,Men,Personal Care,Fragrance,Perfume and Body Mist,Green,Spring,Casual,4711 Men Original Perfume,1017
31828,Men,Free Items,Free Gifts,Free Gifts,Silver,Winter,Casual,Titan Men Off White Dial Watch,1959
19543,Men,Accessories,Gloves,Gloves,Red,Fall,Casual,United Colors of Benetton Men Solid Red Gloves,2368
49799,Men,Accessories,Headwear,Caps,Black,Summer,Casual,Flying Machine Men Black Cap,2878
57026,Men,Apparel,Innerwear,Briefs,Olive,Summer,Casual,Jockey MC Men Olive Rio Briefs 8033,2319
48966,Men,Accessories,Jewellery,Ring,Steel,Summer,Casual,Revv Men Steel Ring,2451
28139,Men,Apparel,Loungewear and Nightwear,Lounge Shorts,Grey Melange,Winter,Casual,Jockey SPORT Men Grey Melange Shorts 9411,2063
17386,Men,Accessories,Mufflers,Mufflers,Black,Fall,Casual,Reid & Taylor Men Solid Black Muffler,2542
28325,Men,Footwear,Sandal,Sandals,Brown,Winter,Casual,Red Tape Men Brown Sandals,1717
23465,Men,Accessories,Scarves,Scarves,Navy Blue,Winter,Casual,Lino Perros Men Navy Blue Check Scarf,1671
14560,Men,Footwear,Shoes,Casual Shoes,Black,Spring,Casual,Vans Men Era Black Casual Shoes,3495
46878,Men,Accessories,Socks,Socks,Black,Summer,Casual,Lino Perros Men Pack of 2 Socks,276
25056,Men,Accessories,Accessories,Accessory Gift Set,Blue,Winter,Formal,Lino Perros Men Formal Blue Accessory Gift Set,1820
8377,Men,Accessories,Bags,Backpacks,Navy Blue,Winter,Casual,Fastrack Men Navy Blue Backpack,2419
40221,Men,Accessories,Belts,Belts,Black,Summer,Casual,Provogue Men Black Leather Belt,2199
48458,Men,Apparel,Bottomwear,Shorts,Blue,Fall,Casual,French Connection Men Blue & White Check Shorts,1754
39040,Men,Accessories,Cufflinks,Cufflinks,Gold,Summer,Formal,Belmonte Men Golden Bright Assorted Cufflinks,1761
40172,Men,Accessories,Eyewear,Sunglasses,Black,Winter,Casual,Fastrack Men UV protected Sporty Wrap Sunglasses,1957
21180,Men,Footwear,Flip Flops,Flip Flops,Black,Summer,Casual,ADIDAS Men Adi Cells Black Flip Flops,4515
44054,Men,Personal Care,Fragrance,Deodorant,Black,Spring,Casual,dunhill Men Deo,1623
36777,Men,Free Items,Free Gifts,Free Gifts,White,Winter,Casual,Maxima Men White Dial Watch,2492
19542,Men,Accessories,Gloves,Gloves,Blue,Fall,Casual,United Colors of Benetton Men Solid Blue Gloves,1511
49798,Men,Accessories,Headwear,Caps,Green,Summer,Casual,Flying Machine Men Green Cap,1498
50567,Men,Apparel,Innerwear,Trunk,Charcoal,Summer,Casual,Chromozome Men Pack of Two Grey Trunks,2775
48575,Men,Accessories,Jewellery,Bracelet,Steel,Summer,Casual,Revv Men Steel Bracelet,2159
50656,Men,Apparel,Loungewear and Nightwear,Lounge Shorts,Navy Blue,Winter,Sports,Chromozome Men Navy Blue Lounge Shorts,2342
17383,Men,Accessories,Mufflers,Mufflers,Cream,Fall,Casual,Reid & Taylor Men Check Cream Muffler,1560
12924,Men,Footwear,Sandal,Sandals,Black,Spring,Casual,iD Men Casual Black Sandals,1950
16011,Men,Accessories,Scarves,Scarves,Black,Fall,Casual,Turtle Check Men Black Scarf,2401
23882,Men,Footwear,Shoes,Sports Shoes,Grey,Fall,Sports,Fila Men Destiny Grey Sports Shoes,3492
32025,Men,Accessories,Socks,Socks,Cream,Summer,Casual,Playboy Men Cream Socks,246
49700,Men,Accessories,Ties,Ties,Navy Blue,Summer,Ethnic,Park Avenue Men Navy Blue Tie,2919
2189,Men,Apparel,Topwear,Tshirts,Grey,Fall,Sports,ADIDAS Men Grey Logo T-shirt,1302
36916,Men,Accessories,Wallets,Wallets,Black,Winter,Casual,Fossil Men Black Evans Wallet,1304
30169,Men,Accessories,Watches,Watches,White,Winter,Casual,Esprit Men White Dial Watch,6927
19929,Men,Accessories,Accessories,Accessory Gift Set,Blue,Fall,Formal,Reid & Taylor Men Formal Blue Tie+Cufflink+Pocket square - Combo Pack,1258
38757,Men,Accessories,Bags,Waist Pouch,Black,Summer,Casual,Nike Men Black Training Waist Pouch,1900
35073,Men,Accessories,Belts,Belts,Brown,Summer,Casual,Allen Solly Men Leather Brown Belt,2853
1572,Men,Apparel,Bottomwear,Track Pants,Black,Fall,Sports,Kalenji Mens Essential Training Track Pants,1542
39033,Men,Accessories,Cufflinks,Cufflinks,Steel,Summer,Formal,Belmonte Men Steel Bright Assorted Cufflinks,2744
8698,Men,Accessories,Eyewear,Sunglasses,Brown,Winter,Casual,Fastrack Men Hip Hop Brown Sunglasses,1109
41213,Men,Footwear,Flip Flops,Flip Flops,Black,Summer,Casual,Lotto Men Black Flip Flops,3331
26203,Men,Personal Care,Fragrance,Perfume and Body Mist,Silver,Spring,Casual,Nautica Men Classic Perfume,1747
44966,Men,Free Items,Free Gifts,Free Gifts,Gold,Winter,Casual,Maxima Men Gold Dial Watch,2829
19441,Men,Accessories,Gloves,Gloves,Black,Summer,Casual,Quiksilver Men Casual Black Gloves,2052
41027,Men,Accessories,Headwear,Caps,Brown,Summer,Casual,Lee Men Brown Cap,1311
57027,Men,Apparel,Innerwear,Briefs,White,Summer,Casual,Jockey MC Men White Brief 8033,2441
48741,Men,Accessories,Jewellery,Bangle,Steel,Summer,Casual,Revv Men Steel Bangle,1270
50651,Men,Apparel,Loungewear and Nightwear,Lounge Shorts,Black,Winter,Casual,Chromozome Men Black Lounge Shorts,2518
13720,Men,Accessories,Mufflers,Mufflers,Maroon,Summer,Casual,Proline Maroon Striped Muffler,2401
11941,Men,Footwear,Sandal,Sandals,Tan,Fall,Casual,Ganuchi Men Casual Tan Sandals,1687
23481,Men,Accessories,Scarves,Scarves,Purple,Summer,Casual,Arrow Men Purple Check Scarf,2388
4455,Men,Footwear,Shoes,Casual Shoes,Brown,Summer,Casual,ADIDAS Khaki Color Canvas Shoe,5763
21572,Men,Accessories,Socks,Socks,Multi,Winter,Casual,Lino Perros Men Pack of Five Striped Socks,294
35088,Men,Accessories,Ties,Ties,Black,Summer,Formal,Allen Solly Men Black Tie,1607
9250,Men,Apparel,Topwear,Shirts,Red,Fall,Formal,Mark Taylor Men Red Striped Shirt,2888
42068,Men,Accessories,Wallets,Wallets,Black,Summer,Casual,American Tourister Men Black Coin Passcase Wallet,2903
29749,Men,Accessories,Watches,Watches,Black,Winter,Casual,Fossil Men Quartz Black Dial Chronograph Watch FS4639,3625
31186,Men,Accessories,Accessories,Accessory Gift Set,Black,Summer,Casual,Cabarelli Men Accessory Gift Set,2822
8223,Men,Accessories,Bags,Backpacks,Black,Winter,Casual,Fastrack Men Black Grey Laptop Backpack,1940
36015,Men,Accessories,Belts,Belts,Black,Summer,Casual,OTLS Men Black Leather Belt,1468
7889,Men,Apparel,Bottomwear,Track Pants,Grey,Fall,Casual,Proline Men Grey Track Pants,1581
39058,Men,Accessories,Cufflinks,Cufflinks,Steel,Fall,Formal,Belmonte Men Steel Button Covers,2576
51692,Men,Accessories,Eyewear,Sunglasses,Grey,Winter,Casual,Louis Philippe Men Oversized Sunglasses LP226-C1,1050
24103,Men,Footwear,Flip Flops,Flip Flops,Blue,Fall,Casual,Playboy Men Casual Blue Flip Flops,5229
23566,Men,Personal Care,Fragrance,Perfume and Body Mist,Blue,Spring,Casual,Boss Men Pure Perfume,1109
51135,Men,Free Items,Free Gifts,Free Gifts,Black,Summer,Casual,Park Avenue Men Black Socks,2054
22495,Men,Footwear,Shoes,Sports Shoes,White,Summer,Sports,ADIDAS Men Adistar Ride 3  White  Sports Shoes,3213
49250,Men,Accessories,Socks,Socks,Brown,Summer,Casual,Arrow Men Pack of 3 Health Socks,331
49740,Men,Accessories,Ties,Ties,Grey,Summer,Formal,Park Avenue Men Grey Tie,2047
14671,Men,Apparel,Topwear,Shirts,Blue,Fall,Casual,Basics Men Blue Slim Fit Checked Shirt,2132
27788,Men,Accessories,Wallets,Wallets,Black,Winter,Casual,Bulchee Men Black Wallet,2656
54645,Men,Accessories,Watches,Watches,Grey,Winter,Casual,Fastrack Men Grey Dial Watch 9915pp11,4889
58923,Men,Accessories,Accessories,Accessory Gift Set,Black,Summer,Casual,Hakashi Men Combo pack Tie+Cufflink+Pocket square,2457
6124,Men,Accessories,Bags,Backpacks,Black,Summer,Casual,Puma Men Motion MR Black  Shoulder Bag,2673
51764,Men,Accessories,Belts,Belts,Black,Summer,Formal,Hidedge Men Black Leather Belt,2323
17291,Men,Apparel,Bottomwear,Trousers,Khaki,Fall,Casual,Peter England Elements  Men Trouser,3436
58865,Men,Accessories,Cufflinks,Cufflinks,Blue,Summer,Casual,Hakashi Men Blue Cufflinks,2210
51707,Men,Accessories,Eyewear,Sunglasses,Grey,Winter,Casual,Van Heusen Men Grey Sunglasses,1186
23825,Men,Footwear,Flip Flops,Flip Flops,Brown,Summer,Casual,Puma Men Java Brown Flip Flops,4510
41901,Men,Personal Care,Fragrance,Perfume and Body Mist,Black,Spring,Casual,Playboy Men Hollywood Perfume Buy 1 Get 1 free,1115
28353,Men,Free Items,Free Gifts,Free Gifts,Black,Winter,Casual,IDEE Men Black Sunglasses,1509
18209,Men,Accessories,Headwear,Caps,Navy Blue,Fall,Casual,Manchester United Men Printed Navy Blue Cap,2571
28055,Men,Apparel,Innerwear,Briefs,Red,Summer,Casual,Jockey ELANCE Men Red Pack of 2 Briefs 1009,2325
48580,Men,Accessories,Jewellery,Bracelet,Steel,Summer,Casual,Revv Men Steel Bracelet,1794
56250,Men,Apparel,Loungewear and Nightwear,Night suits,Grey Melange,Summer,Casual,SDL by Sweet Dreams Men Grey Melange Pyjama Set,3972
20068,Men,Accessories,Mufflers,Mufflers,Green,Summer,Casual,United Colors of Benetton Men Solid Green Muffler,1946
7319,Men,Footwear,Sandal,Sandals,Black,Winter,Casual,Red Tape Men Black Floater,1881
23487,Men,Accessories,Scarves,Scarves,Grey,Summer,Casual,Arrow Men Grey Scarf,2859
46324,Men,Footwear,Shoes,Sports Shoes,Grey,Summer,Sports,Reebok Men Grey Premier Road Supreme Sports Shoes,5316
18360,Men,Accessories,Socks,Socks,Black,Fall,Casual,Fila  Men Crew Black Socks,371
49707,Men,Accessories,Ties,Ties,Maroon,Summer,Casual,Park Avenue Men Maroon Tie,2065
7567,Men,Apparel,Topwear,Tshirts,Orange,Summer,Sports,Nike Men's As Sublimated Orange T-shirt,935
12443,Men,Accessories,Wallets,Wallets,Black,Fall,Casual,Timberland Men Casual Black Wallets,1359
45893,Men,Accessories,Watches,Watches,Black,Winter,Casual,Maxima Ssteele Men Black Dial Watch,3410
17376,Men,Accessories,Accessories,Accessory Gift Set,Red,Fall,Formal,Arrow Men Formal Red Tie+Cufflink+Pocket square - Combo Pack,1484
29007,Men,Accessories,Bags,Backpacks,Black,Summer,Casual,Cabarelli Men Black Backpack,1906
34801,Men,Accessories,Belts,Belts,Black,Summer,Casual,Flying Machine Men Woven Black Belt,2608
17623,Men,Apparel,Bottomwear,Track Pants,Grey,Fall,Sports,ADIDAS Men Solid Grey Track Pant,1697
58861,Men,Accessories,Cufflinks,Cufflinks,Copper,Summer,Casual,Hakashi Men Copper Cufflinks,1984
48213,Men,Accessories,Eyewear,Sunglasses,Brown,Winter,Casual,United Colors of Benetton Men Brown Sunglasses,1435
48527,Men,Footwear,Flip Flops,Flip Flops,Navy Blue,Fall,Casual,Calvin Klein Men Flip Flops,3755
25994,Men,Personal Care,Fragrance,Perfume and Body Mist,Black,Spring,Casual,Jaguar Prestige Men Perfume,1036
54968,Men,Free Items,Free Gifts,Free Gifts,Black,Spring,Casual,Rasasi Men Skill Power Deo,1809
18212,Men,Accessories,Headwear,Caps,White,Fall,Casual,Manchester United Men Solid White Cap,2739
25366,Men,Apparel,Innerwear,Innerwear Vests,Green,Summer,Casual,Levis Men Green Innerwear T-shirt,697
48563,Men,Accessories,Jewellery,Bracelet,Steel,Summer,Casual,Revv Men Steel Bracelet,1894
56265,Men,Apparel,Loungewear and Nightwear,Night suits,Red,Summer,Casual,SDL by Sweet Dreams Men Red & Blue Pyjama Set,2774
17388,Men,Accessories,Mufflers,Mufflers,Blue,Fall,Casual,Reid & Taylor Men Check Blue Muffler,1831
34119,Men,Footwear,Sandal,Sandals,Brown,Summer,Casual,Clarks Men Brown Leather Sandals,1797
23486,Men,Accessories,Scarves,Scarves,Grey,Summer,Casual,Arrow Men Grey Check Scarf,2449
46796,Men,Footwear,Shoes,Formal Shoes,Black,Summer,Formal,Arrow Men Black Formal Shoes,5138
12393,Men,Accessories,Socks,Socks,Black,Summer,Formal,Reid & Taylor Men Solid Black Socks,265
58913,Men,Accessories,Ties,Ties,Red,Summer,Casual,Hakashi Men Red Silk Tie,1498
22378,Men,Apparel,Topwear,Shirts,Purple,Fall,Casual,Mark Taylor Men Purple Striped White Shirt,2580
21812,Men,Accessories,Wallets,Wallets,Brown,Winter,Casual,Fossil Men Flyby Brown Wallet,2015
36792,Men,Accessories,Watches,Watches,Black,Winter,Casual,Maxima Men Black Dial Attivo Watch,6672
58921,Men,Accessories,Accessories,Accessory Gift Set,Multi,Summer,Casual,Hakashi Men Combo pack Tie+Cufflink+Pocket square,1962
20931,Men,Accessories,Bags,Backpacks,Black,Winter,Casual,Fastrack Men Polyester Black Backpack,1545
46071,Men,Accessories,Belts,Belts,Black,Summer,Casual,Lino Perros Men Black Leather Belt,2518
15480,Men,Apparel,Bottomwear,Track Pants,Brown,Fall,Casual,Puma Men Ess Sweat Pants Open Bottom Brown Track Pants,2484
58842,Men,Accessories,Cufflinks,Cufflinks,Black,Summer,Casual,Hakashi Men Black Cufflinks,2062
29962,Men,Accessories,Eyewear,Sunglasses,Black,Winter,Casual,Cat Men Sheet Sunglasses,1949
11845,Men,Footwear,Flip Flops,Flip Flops,Brown,Summer,Casual,Playboy Men Brown Flip Flops,3277
43962,Men,Personal Care,Fragrance,Perfume and Body Mist,Brown,Spring,Casual,aramis Men Classic EDT 110 ml,1078
53598,Men,Free Items,Free Gifts,Free Gifts,Black,Winter,Sports,Q&Q Men Black Digital Watch,1928
49790,Men,Accessories,Headwear,Caps,Black,Summer,Casual,Flying Machine Men Black Cap,1956
25358,Men,Apparel,Innerwear,Briefs,Black,Summer,Casual,Levis Men Black & Red Brief,3770
48807,Men,Accessories,Jewellery,Pendant,Steel,Summer,Casual,Revv Men Steel Pendant,2950
36255,Men,Apparel,Loungewear and Nightwear,Night suits,Grey,Summer,Casual,SDL by Sweet Dreams Men Grey & Red Pyjama Set,2884
25402,Men,Accessories,Mufflers,Mufflers,Red,Summer,Casual,Nike Men Striped Manchester United Red Scarf,2466
28328,Men,Footwear,Sandal,Sandals,Brown,Winter,Casual,Red Tape Men Casual Brown Sandals,2087
23464,Men,Accessories,Scarves,Scarves,Black,Winter,Casual,Lino Perros Men Black Check Scarf,2754
12856,Men,Footwear,Shoes,Casual Shoes,Black,Spring,Casual,Lee Cooper Men Formal Black Shoes,3099
32000,Men,Accessories,Socks,Socks,Brown,Summer,Formal,Playboy Men Brown Socks,313
36361,Men,Accessories,Ties,Ties,Black,Summer,Formal,Reid & Taylor Men Black Tie,2662
4362,Men,Apparel,Topwear,Tshirts,Grey,Summer,Casual,Free Authority Men's Ship O Fools Grey Violet T-shirt,1337
38296,Men,Accessories,Wallets,Wallets,Brown,Summer,Casual,Reid & Taylor Men Brown Wallet,2590
33903,Men,Accessories,Watches,Watches,White,Summer,Casual,Citizen Men White Dial Watch,6925
23113,Men,Accessories,Accessories,Accessory Gift Set,Purple,Fall,Formal,Turtle Men Purple Accessory Gift Set,1293
11123,Men,Accessories,Bags,Laptop Bag,Black,Fall,Casual,United Colors of Benetton Men Travel Black Bags,1662
27811,Men,Accessories,Belts,Belts,Black,Summer,Casual,Bulchee Men Brown And Black Reversible Belt,1513
14941,Men,Apparel,Bottomwear,Shorts,White,Fall,Casual,Status Quo Men Solid White Shorts,1590
58854,Men,Accessories,Cufflinks,Cufflinks,Steel,Summer,Casual,Hakashi Men Steel Cufflinks,2000
28191,Men,Accessories,Eyewear,Sunglasses,Black,Winter,Casual,Ray-Ban Men Aviator Black Sunglasses,1025
30241,Men,Footwear,Flip Flops,Flip Flops,Black,Summer,Casual,Numero Uno Men Black Flip Flops,3656
23529,Men,Personal Care,Fragrance,Perfume and Body Mist,Brown,Spring,Casual,Aramis Men Classic EDT Perfume,1286
15349,Men,Free Items,Free Gifts,Free Gifts,Blue,Winter,Sports,Nike Men Blue Team India Cricket Jersey,2196
43553,Men,Accessories,Headwear,Caps,Black,Summer,Casual,Puma Men Black Complete Running Cap,2570
18694,Men,Apparel,Innerwear,Trunk,Blue,Summer,Casual,Hanes Men Blue Modern Duo Dry Cotton Stretch Trunks,2836
48950,Men,Accessories,Jewellery,Ring,Steel,Summer,Casual,Revv Men Steel Ring,2693
50661,Men,Apparel,Loungewear and Nightwear,Lounge Pants,Grey Melange,Summer,Sports,Chromozome Men Grey Melange Lounge Pants,2953
13810,Men,Accessories,Mufflers,Mufflers,White,Summer,Casual,Proline White Striped Muffler,1870
41858,Men,Footwear,Sandal,Sandals,Brown,Summer,Casual,Estd. 1977 Men Brown Sandals,2284
23476,Men,Accessories,Scarves,Scarves,Grey,Winter,Casual,Lino Perros Men Grey Check Scarf,1571
2633,Men,Footwear,Shoes,Heels,Black,Summer,Smart Casual,Carlton London Men Black Leather Casual Shoes.,5639
32029,Men,Accessories,Socks,Socks,Grey,Summer,Sports,Playboy Men Pack of 3 Socks,335
